"id","oblast","importance","name","category","type","area.ha","desig.decision","operator","location"
1,"Донецька","загальнодержавне","Український степовий: Хомутовський степ","природний заповідник",,1030.4,"Постанова Маріупольського Окрвиконкому від 24.08.26 Постанова РМ УРСР №1118 від 22.07.61","Український степовий природний заповідник","Новоазовський р-н, с. Хомутове"
2,"Донецька","загальнодержавне","Український степовий: Кам’яні Могили","природний заповідник",,289.2,"Постанова Президії Маріупольського Окрвиконкому від 05.04.27, постанова РМ УРСР №1118 від 22.07.61","Український степовий природний заповідник","Володарський р-н,"
3,"Донецька","загальнодержавне","Український степовий: Крейдяна флора","природний заповідник",,1134,"Розпорядження РМ УРСР №310 - Р від 14.07.88","Український степовий природний заповідник","Новокраснівська сільска рада, біля с. Назарівка Слов’янський р-н, біля с. Піскунівка, Краснолиманський р-н , біля с. Закітне та с. Крива Лука Слов’янський (634,0 га) та Краснолиманський р-ни (500,0 га)"
4,"Донецька","загальнодержавне","Український степовий: Кальміуське","природний заповідник",,579.6,"Указ Президента України від 19.08.08 №723/2008","Український степовий природний заповідник","Тельманівський р-н, с.Стара Ласпа"
5,"Донецька","загальнодержавне","Святі Гори","національний природний парк",,40605.5,"Указ Президента України №135/97 від 13.02.97,","Слов’янський р-н, ДП Слов'янське лісове господарство, Долинська сільська рада Краснолиманський р-н, Краснолиманська міська рада, Криволуцька сільська рада, м. Святогірськ","Слов’янський та Краснолиманський р-ни, м. Слов’яногірськ"
6,"Донецька","загальнодержавне","Меотида","національний природний парк",,20720.9531,"Указ Президента України № 1099/2009 від 25.12.09","ДП Приазовське лісове господарство, Володарська райдержадміністрація, риболовецьке колективне господарство Прибой, Новоазовська райдержадміністрація","Володарський, Новоазовський та Першотравневий райони"
7,"Донецька","загальнодержавне","Бердянський","заказник","лісовий",413,"Постанова РМ УРСР №500 від 28.10.74","ДП Амвросіївське лісове господарство","Амвросіївський р-н, ДП Амвросіївське лісове господарство, Благодатнівське л-во, кв. 10-14; Степано-Кринське л-во, кв.31-35"
8,"Донецька","загальнодержавне","Великоанодольський","заказник","лісовий",2543,"Постанова РМ УРСР №500 від 28.10.74","ДП Великоанодольське лісове господарство","Волноваський р-н,ДП Великоанодольське лісове господарство, Великоанодольське л-во, кв. 1-90"
9,"Донецька","загальнодержавне","Білосарайська коса","заказник","ландшафтний",616,"Постанова РМ УРСР №132 від 25.02.80","ДП Приазовське лісове господарство","Першотравневий р-н, ДП Приазовське лісове господарство, Стародубівське л-во, кв. 51-58, акваторія Азовського моря –200,0 га"
10,"Донецька","загальнодержавне","Роздольненський","заказник","геологічний",100,"Постанова РМ УРСР №500 від 28.10.74","Роздольненська сільська рада","Старобешівський р-н, с. Роздольне"
11,"Донецька","загальнодержавне","Приазовський чапельник","заказник","орнітологічний",100,"Указ Президента України №1207/2000 від 04.11.2000","Першотравнева районна рада","Першотравневий р-н, смт. Ялта,"
12,"Донецька","загальнодержавне","Єланчанські бакаї","заказник","орнітологічний",289,"Указ Президента України №167/2002 від 21.02.2002","ДП Тельманівське лісове господарство, АЦ № 27 ДП Ілліч-Агро Донбас","Новоазовський р-н, с. Самсонове"
13,"Донецька","загальнодержавне","Бакаї Кривої коси","заказник","орнітологічний",567.6,"Указ Президента України №167/2002 від 21.02.2002","ДП Тельманівське лісове господарство, Седовська селищна.рада","Новоазовський р-н, смт Сєдове"
14,"Донецька","загальнодержавне","Дружківські закам’янілі дерева","пам’ятка природи","геологічна",1,"Розпорядження РМ УРСР №780 - р від 14.10.75","Кондратівська сільська рада","Костянтинівський р-н, смт Олексієво-Дружківка"
15,"Донецька","загальнодержавне","Клебан - Бицьке відслонення","пам’ятка природи","геологічна",60,"Розпорядження РМ УРСР №780 - р від 14.10.75","Іллічівська сільська рада","Костянтинівський р-н, лівий берег Клебан-Бикського водосховища"
16,"Донецька","загальнодержавне","Балка Кровецька","пам’ятка природи","геологічна",15,"Розпорядження РМ УРСР 780 - р від №14.10.75","Іванопільська сільська рада","Костянтинівський р-н, східна околиця с. Іванопілля"
17,"Донецька","загальнодержавне","Новокатеринівське відслонення","пам’ятка природи","геологічна",10,"Розпорядження РМ УРСР №780 - р від 14.10.75","Осиківська сільська рада","Старобешівський р-н,с. Новокатеринівка"
18,"Донецька","загальнодержавне","Стильське відслонення","пам’ятка природи","геологічна",25,"Розпорядження РМ УРСР №780 - р від 14.10.75","Стильська сільська рада","Старобешівський р-н, с. Стила, берег Стильського водосховища"
19,"Донецька","загальнодержавне","Балка Гірка","пам’ятка природи","ботанічна",4,"Розпорядження РМ УРСР №780 - р від 14.10.75","ДП Амвросіївське лісове господарство","Амвросіївський р-н, ДП Амвросіївське лісове господарство Амвросіївське л-во, кв. 22, в. 8"
20,"Донецька","загальнодержавне","Маяцька дача","пам’ятка природи","ботанічна",18,"Розпорядження РМ УРСР №780 - р від 14.10.75","ДП Слов’янське лісове господарство","Слов’янський р-н, ДП Слов’янське лісове господарство, Маяцьке л-во, кв. 114"
21,"Донецька","загальнодержавне","Урочище Грабове","пам’ятка природи","ботанічна",41,"Рішення виконкому обласної ради № 310 від 21. 06. 72 та Розпорядженн Р М УРСР №780 - р від 14.10.75","ДП Торезьке лісове господарство","Шахтарський р-н, , ДП Торезьке лісове господарство, Торезьке л-во, кв. 1"
22,"Донецька","загальнодержавне","Озеро Ріпне","пам’ятка природи","гідрологічна",32,"Розпорядження РМ УРСР №780 - р від 14.10.75","ЗАТ лікувально-оздоровчих закладів профспілок України Укрпрофоздоровниця, дочірнє підприємство Слов`янська гідрологічна режимно-експлуатаційна станція","м. Слов’янськ"
23,"Донецька","загальнодержавне","Озеро Сліпне","пам’ятка природи","гідрологічна",30,"Розпорядження РМ УРСР №780 - р від 14.10.75","ЗАТ лікувально-оздоровчих закладів профспілок України Укрпрофоздоровниця, дочірнє підприємство Слов`янська гідрологічна режимно-експлуатаційна станція","м. Слов’янськ"
24,"Донецька","загальнодержавне","Донецький ботанічний сад","ботанічний сад",,203,"Постанова РМ та ЦК КП Української РСР № 805 від 28.07.64, Постанова РМ УРСР №311 від 22.07.83, Указ Президента України № 1392/2004 від 10.11.2004","Донецький ботанічний сад НАН України","На північному сході м. Донецька"
25,"Донецька","місцеве","Меотида","регіональний ландшафтний парк",,14351.9,"рішення обласної ради від 30.06.2000 №23/14-304 та від 20.07.2004 №4/17-474","АЦ №22 ДП Ілліч-Агро Донбас Зеленоярської сільської ради, АЦ №20 ДП Ілліча-Агро Донбас Старченківської сільської ради, Саханська Сільська рада, Безіменська сільська рада, Розовська сільська рада, Сєдовська сільська рада, Новоазовська міська рада, Стародубівська сільська рада, Урзуфська сільська рада, Ялтинська сільська рада, Мелекинська сільська рада, Іллічівська сільська рада.","Новоазовський р-н (5078,2 га), Першотравневий р-н (8168,7 га), Володарський р-н (1105,0 га) та вузька смуга узбережжя Азовського моря"
26,"Донецька","місцеве","Донецький кряж","регіональний ландшафтний парк",,7463.52,"рішення обласної ради від 29.02.2000 №23/11-254, №3/16-364 від 09.11.2000 та № 5/18-561 від 26.09.2008","Степановська сільська рада, КСП Нива Мануйлівська сільська рада, ДП Амвросіївське лісове господарство, СТОВ Зоря, СГВК 1 Травня Благодатнівської сільської ради","Шахтарський р-н (біля с. Саурівка та с. Петрівське) – 1599,2 га Амвросіївський р-н (біля с.Артемівка) – 2353,0 га"
27,"Донецька","місцеве","Клебан-Бик","регіональний ландшафтний парк",,2900.1,"Рішення обласної ради №23/11-256 від 29.02.2000, №4/2-37 від 23.05.02 та №4/31-775 від 23.12.05.","Катеринівська сільська рада, СТОВ Імпульс, ДП Красноармійське лісове господарство, Олександро-Калинівська сільська рада, Іллічівська сільська рада, СТОВ Обрій, Марківська сільська рада, СТОВ Новодмитрієвське, СТОВ ім. Суворова, Кондратівська сільська рада, Іванопільська сільська рада, ДП Слов’янське лісове господарство, Предтечинська сільська рада, Артемівський район Красненська сільська рада (30,74 га)","Костянтинівський та Артемівський р-ни, обидва береги Клебан-Бицького водосховище, територія Білокузьминівська та урочище Стінки"
28,"Донецька","місцеве","Зуївський","регіональний ландшафтний парк",,1532.6629,"Рішення обласної ради №4/3-58 від 03.09.02 Рішення Донецької облради від 30.05.2013 № 6/21-523","Зуївська сільська рада, Донецьке обласне управління лісового та мисливського господарства, СТОВ Мир, радгосп Зуївський","м. Харцизьк, смт Зуївка, заплава р. Кринка"
29,"Донецька","місцеве","Краматорський","регіональний ландшафтний парк",,2247.82,"Рішення Донецької облради від 18.05.04 № 4/16-451 Рішення Донецької облради від 26.12.2013 №6/27-671","Краматорська міська рада, Біленьківська сільська рада, Красноторська сільська рада, ДП Слов`янське лісове господарство","м.Краматорськ"
30,"Донецька","місцеве","Слов`янський курорт","регіональний ландшафтний парк",,431.31,"Рішення Донецької обласної ради від 23.12.05 №4/31-773","Слов`янська міська рада","м.Слов`янськ"
31,"Донецька","місцеве","Артемівські садово-дендрологічні насадження","заказник","ландшафтний",2071.29,"Рішення виконкому обласної. Ради №276 від 27.06.84 та №3/25-639 від 22.03.02","Дослідне господарство Садове Артемівської дослідної станції розсадництва Інституту дослідництва УААН","Артемівський р-н, с-ще Опитне"
32,"Донецька","місцеве","Ліс по річці Кринка","заказник","ландшафтний",25,"Рішення виконкому обласної Ради № 276 від 27.06.84","Благодатнівська сільська рада","Амвросівський р-н, поблизу с-ща Родники"
33,"Донецька","місцеве","Ларинський","заказник","ландшафтний",70,"Рішення обласно ради №4/3-59 від 03.09.2002","Ларинська сільська рада","м. Донецьк, між смт Павлоградське та смт Ларинське"
34,"Донецька","місцеве","Красногорівський","заказник","ландшафтний",15.43,"Ріш6ення обласної ради №3/21-496 від 06.09.2001","Красногорівська міська рада","Мар’їнський р-н, поблизу м. Красногорівка"
35,"Донецька","місцеве","Щуча заводь","заказник","ландшафтний",27,"Рішення обласної ради №3/15-353 від 11.09.2000","Комарська сільська рада","Великоновосілківський р-н, між селами Запоріжжя та Ялта"
36,"Донецька","місцеве","Нескучненський ліс","заказник","ландшафтний",16,"Рішення виконкому обласної Ради №276 від 27.06.84","ДП Великоанадольське лісове господарство","Великоновосілківський р-н, Великоновосілківське л-во, кв. 51"
37,"Донецька","місцеве","Ямполівський","заказник","ландшафтний",77,"Рішення виконкому обласної Ради №549 від 24.12 .86","ДП Краснолиманське лісове господарство","Краснолиманський р-н, с. Терни, ДП Краснолиманське лісове господарство, Торське л-во"
38,"Донецька","місцеве","Бесташ","заказник","ландшафтний",437,"Рішення обласної ради .№23/7-70 від 17.08.99","Старченковська с.р.","Володарський р-н, с. Старченкове"
39,"Донецька","місцеве","Урочище Зоря","заказник","ландшафтний",109,"Рішення обласної ради №3/25-638 від 22.03.2002","ДП Красноармійське лісове господарство","Красноармійський р-н, ДП Красноармійське лісове господарстов, Красноармійське л-во, кв.39"
40,"Донецька","місцеве","Балка Скелева","заказник","ландшафтний",117.8,"Рішення обласної ради від 14.05.2010 № 5/28-887","Ольховатська селищна рада м. Єнакієве","Єнакієвська міська рада в межах Ольховатської селищної ради"
41,"Донецька","місцеве",,"заказник","ландшафтний",34.3787,"Рішення обласної ради від 25.03.2013 №6/21-521",,
42,"Донецька","місцеве","Новосілківський","заказник","ентомологічний",3,"Рішення виконкому обласної Ради №652 від 17.12.82","Великоновосілківська сільська рада","Великоновосілківський р-н, смт Велика Новосілка"
43,"Донецька","місцеве","Старченківський","заказник","ентомологічний",5,"Ріш. виконкому обл. Ради №652 від 17.12.82","Старченковська с.р.","Володарський р-н, с. Старченкове"
44,"Донецька","місцеве","Кальчицький","заказник","ентомологічний",2,"Рішення виконкому обласної Ради №652 від 17.12.82","Тополинська сільська рада","Володарський р-н, біля с. Шевченко"
45,"Донецька","місцеве","Старомихайлівський","заказник","ентомологічний",0.5,"Рішення виконкому обласної Ради №652 від 17.12.82","СФГ Колос","Мар’їнський р-н, близько с-ща Старомихайлівка"
46,"Донецька","місцеве","Круглик","заказник","ентомологічний",12.9,"Рішення обласної Ради від 10.03.93","Нікішинська сільська рада","Шахтарський р-н, на схід від с. Нікішине"
47,"Донецька","місцеве","Кривокоський лиман","заказник","орнітологічний",468.7,"Рішення виконкому обласної Ради №155 від 11.03.81 та №319 від 16.09.88","Сєдовська селищна рада","Новоазовський р-н, смт Сєдове"
48,"Донецька","місцеве","Приозерний","заказник","орнітологічний",79.5,"Рішення обласної ради №3/22-558 від 06.12.2001 та №3/22-558 від 23.12.05","Слов`янська міська рада","м. Слов’янськ, друга санзона Слов’янського курорту в заплаві р. Калантаївка"
49,"Донецька","місцеве","Азовська дача","заказник","лісовий",1678,"Рішення виконкому обласної Ради №276 від 27.06.84","ДП Приазовське лісове господарство Володарська селищна рада","Володарський р-н, ДП Приазовське лісове господарстов, Азовське л-во, кв. 1-72, поблизу смт Володарське"
50,"Донецька","місцеве","Заплава – 1","заказник","лісовий",590,"Рішення виконкому обласної Ради №310 від 21.06.72 та №276 від 27.06.84","ДП Слов’янське лісове господарство","Слов’янський р-н, ДП Слов’янське лісове господарство, Маяцьке л-во, кв. 174-185"
51,"Донецька","місцеве","Урочище Софіївське","заказник","лісовий",565,"Рішення виконкому обласної. Ради №310 від 21.06.72 та №276 від 27.06.84","ДП Горлівське лісове господарство","м. Горлівка, ДП Горлівське лісове господарство,Єнакіївське л-во, кв. 28-49"
52,"Донецька","місцеве","Урочище Россоховате","заказник","лісовий",100,"Рішення виконкому обласної Ради №310 від 21.06.72 та №276 від 27.06.84","ДП Горлівське лісове господарство","м. Єнакієве, ДП Горлівське лісове господарство,Єнакіївське л-во, кв. 54,61,63,64"
53,"Донецька","місцеве","Урочище Плоське","заказник","лісовий",129,"Рішення виконкому обл. Ради №310 від 21.06.72 та №276 від 27.06.84","ДП Горлівське лісове господарство","м. Єнакієве, ДП Горлівське лісове господарство, Єнакіївське л-во, кв. 151-155"
54,"Донецька","місцеве","Урочище Леонт’єво-Байрацьке","заказник","лісовий",1290,"Рішення виконкому обласної Ради №622 від 25.12.75 та №276 від 27.06.84","ДП Торезьке лісове господарство","м. Сніжне, ДП Торезьке лісове господарство, Сніжнянське л-во, кв. 31-56"
55,"Донецька","місцеве","Пристенське","заказник","ботанічний",250,"Рішення виконкому обласної Ради №9 від 10.01.79","ДП Амвросіївське лісове господарство","Амвросіївський р-н, ДП Амвросіївське лісове господарство, Амвросіївське л-во, кв.14, 16-19"
56,"Донецька","місцеве","Балка Північна","заказник","ботанічний",12,"Рішення виконкому обласної Ради №7 від 09.01.91","Великоновосілківська селищна рада","Великоновосілківський р-н, біля с. Времівка"
57,"Донецька","місцеве","Балка Орлинська","заказник","ботанічний",9,"Рішення облвиконкому №652 від 17.12.82 р.","Старомлинівська сільська рада","Великоновосілківський р-н, 5 км на південний захід від с. Старомлинівка"
