23;«Цілинна балка Троїцька, ділянка №1»;заказник;ентомологічний;17;Мелітопольський район, біля с.Троїцьке;ДП «Мелітопольске лісомисливське господарство»;Рішення Запорізького облвиконкому від 25.09.1984р. №315
24;«Цілинна ділянка в степу»;заказник;ентомологічний;18;Веселівський р-н, в межах земель  Корніївської  сільської ради;Корніївська сільська рада;Рішення Запорізького облвиконкому від 25.09.1984р. №315
25;«Заліснена балка»;заказник;ентомологічний;20;Токмакський р-н, поля № 7-8;Очеретуватська сільська рада;Рішення Запорізького облвиконкому від 25.09.1984р. №315
26;«Цілинна балка з кам’янистими оголеннями»;заказник;ентомологічний;20;Чернігівський р-н, бригада №2;Новомихайлівська сільська рада;Рішення Запорізького облвиконкому від 25.09.1984р. №315
27;«Цілинна кам’яна ділянка»;заказник;ентомологічний;20;Куйбишевський р-н, с.Сміле, між полями сівозміни VII і VIII;Смилівська сільська рада;Рішення Запорізького облвиконкому від 25.09.1984р. №315
28;«Балка Коньякова»;заказник;ентомологічний;20;Куйбишевський р-н, с.Благовіщенка, між полями сівозміни ІІІ і VI;Благовіщенська сільска рада;Рішення Запорізького облвиконкому від 25.09.1984р. №315
29;«Полога балка»;заказник;ентомологічний;27;Токмакський р-н, по межі з землями Жовтневої сільської ради;Новенська сільська рада;Рішення Запорізького облвиконкому від 25.09.1984р. №315
30;«Цілинна ділянка «;заказник;ентомологічний;30;Вільнянський р-н, на південь від с.Райське;Московська сільська рада;Рішення Запорізького облвиконкому від 25.09.1984р. №315
31;«Балка Оріхівська»;заказник;ентомологічний;30;Оріхівський р-н, в межах земель Преображенської сільської ради;Преображенська сільська  рада;Рішення Запорізького облвиконкому від 25.09.1984р. №315
32;«Цілинна ділянка»;заказник;ентомологічний;30;Бердянський р-н, с.Полоузівка;Андрівська с/р;Рішення Запорізького облвиконкому від 25.09.1984р. №315
33;«Балка Чуграєва»;заказник;ентомологічний;35;Оріхівський р-н, в межах земель Новоандріївської сільської ради;Новоандріївська сільська рада;Рішення Запорізького облвиконкому від 25.09.1984р. №315
34;«Балка біля ставка»;заказник;ентомологічний;44;Бердянський р-н, ДП «Бердянське лісове господарство» - 42 га, Андрівська с/р - 2 га;ДП «Бердянське лісове господарство», Андрівська с/р;Рішення Запорізького облвиконкому від 25.09.1984р. №315
35;«Цілина Черноморченка»;заказник;ентомологічний;37;Веселівський р-н, в межах земель Веселівської виправної колонії № 8 Запорізької області УДДУ ПВП, біля с. Озерне;Веселівська виправна колонія № 8 Запорізької області УДДУ ПВП;Рішення Запорізького облвиконкому від 25.09.1984р. №315
36;«Балка Сидельникова»;заказник;ентомологічний;55;Оріхівський  р-н, в межах земель Новоандріївської сільської ради;Новоандріївська сільська рада;Рішення Запорізького облвиконкому від 25.09.1984р. №315
37;«Цілинна ділянка в поймі р.Корсак»;заказник;ентомологічний;57;Приазовський р-н, с. Дмитрівка;Дмитрівська с/р;Рішення Запорізького облвиконкому від 25.09.1984р. №315
38;«Вигін»;заказник;ентомологічний;62;Бердянський р-н, в межах Дмитрівської с/р;Дмитрівська с/р;Рішення Запоізького облвиконкому від 22.08.1982р. №431
39;«Цілинна ділянка в поймі р.Корсак»;заказник;ентомологічний;63;Приазовський р-н, с. Дмитрівка;Богданівська с/р;Рішення Запорізького облвиконкому від 25.09.1984р. №315
40;«Балка Вовча»;заказник;ентомологічний;69;Бердянський р-н, в межах земель ДП «Бердянське ЛГ»;Осипенківська с/р;Рішення Запо-різького обл- виконкому від 22.08.1982р. №431
41;«Балка Норова»;заказник;ентомологічний;70;Оріхівський р-н, с.Юрківка;Юрківська сільська рада;Рішення Запорізького облвиконкому від 25.09.1984р. №315
42;«Балка Засоріна»;заказник;ентомологічний;87;Бердянський р-н, в межах земель Осипенківської с/р;Осипенківська с/р;Рішення Запоізького облвиконкому від 22.08.1982р. №431
43;Цілинна балка;заказник;ентомологічний;2;Кам`янсько-Дніпровський район, в межах земель Дніпровської сільської ради;Дніпровська сільська рада;Рішення Запорізького облвиконкому від 25.09.1984р. №315
43;Разом заказників ентомологічних;43;;939,9;;;
1;«Каштанівський»;заказник;загальнозоологічний;12;Новомиколаївський район, 1 км на північ від с.Каштанівка;Новоіванківська сільська рада;Рішення Запорізької обласної ради від 27.11.1998р. №10
2;«Герпетологічний заказник»;заказник;загальнозоологічний;23;Василівський р-н, біля с.Широке;Широківська сільська рада;Рішення Запоізького облвиконкому від 09.10.1990р. №281
3;«Д’яконські сади»;заказник;загальнозоологічний;33,7;Кам’янсько Дніпровський район с.Велика Знам’янка;Великознам`янська сільська рада;Розпорядження представника Президента від 2.10.1992р. №321
4;«Лубенцівський»;заказник;загальнозоологічний;142,9;Новомиколаївський та Вільнянський райони, 1,5 км на захід від с.Богунівка;Новоіванківська сільська рада, Максимівська сільська рада;Рішення Запорізької обласної ради від 17.08.1998р. №7
4;Разом заказників загальнозоологічних;4;;211,6;;;
1.  ;«Балка Хуторська»;заказник;ландшафтний;7;Запорізький р-н, 300 м на північ від с.Сонячне;Дослідне господарство «Сонячне» Інституту олійних культур;Рішення Запорізької обласної ради №10 від 27.11.1998р
2.  ;«Салтичійське степове помістя»;заказник;ландшафтний;12,77;Чернігівський р-н, в межах с.Салтичія на лівому березі правої р.Салтич;Обіточненська сільська рада;Рішення Запорізької обласної ради від 25.12.2001р. №5
3.  ;«Балка Гадюча»;заказник;ландшафтний;16,8;Запорізький р-н, 2,5 км на південий захід від с.Володимирівка;Володимирівська сільська рада;Рішення Запорізької обласної ради №10 від 27.11.1998р
4.  ;«Володимирівський»;заказник;ландшафтний;18;Запорізький р-н, 500 м на захід від с.Володимирівка;Володимирівська сільська рада;Рішення Запорізької обласної ради №10 від 27.11.1998р
5.  ;«Балка Найвер» (охоронна зона 30 м);заказник;ландшафтний;27;Токмакський р-н, в балці «Найвер» кв. № 60,  вид. 2 (10 га), вид. 3 (3,5 га), вид. 4 (6,8 га),  вид. 5 (6,7 га) Токмацького лісництва;ДП «Приморське лісове господарство»;Розпорядження Представника Президента України в Запорізькій області від 2.04.1992р. №321
6.;«Цілинна балка»;заказник;ландшафтний;21,8;Гуляйпольський р-н в межах земель Гуляйпільське лісництво, кв.3, вид. 2,4-10,12;ДП «Пологівське ЛМГ»;Рішення Запорізької обласної ради від 27.11.1998р. №10
7.;«Сосновий бір Куліша»;заказник;ландшафтний;30;в межах земель дослідного госпадарства «Соц. Землеробство» Запорізької державної с/г дослідної станції УААН, біля с. Таврія;Дослідне госпадарство «Соц. Землеробства» Запорізької державної с/г  дослідної станції УААН;Рішення обласної ради  від 17.08.1999р. №7
8.  ;«Заплава р.Малий Утлюк»;заказник;ландшафтний;30,2;Якимівський район, на правому березі р. Малий утлюк, біля с.Давидівка;Давидівська сільська рада;Рішення Запорізької обласної ради від 25.12.2001р. №5
9.  ;«Водяне»;заказник;ландшафтний;37;Куйбишевський р-н, 2 км на південий схід від с.Тітово;Титовська сільська рада;Рішення Запорізької обласної ради від 27.11.1998р. №10
10.  ;«Урочище скелі»;заказник;ландшафтний;40;Чернігівський р-н, в межах с.Верхній Токмак, вздовж лівого та правого берегів р.Томачка;Верхньотокмацька  сільська рада;Рішення Запорізької обласної ради від 25.12.2001р. №5
11.  ;«Хвойно-листяний ліс з степовою ділянкою і струмком» (охоронна зона 30 м);заказник;ландшафтний;43,7;Новомиколаївський район, біля с.Зарічне;Тернуватська сільська рада;Розпорядження Представника Президента України в Запорізькій області від 2.10.1992р. №321
12.  ;«Балка Садова»;заказник;ландшафтний;45,9;Новомиколаївський  район, в межех полів №2,3 сівозміну Софіївська сільська рада і межує з землями Новомиколаївського кінзаводу;Софіївська сільська рада;Розпорядження представника Президента України від 31.12.1993р. №665
13.  ;«Балка Малишевська»;заказник;ландшафтний;49;Запорізький р-н, 500 м на схід від с.Малишівка;Дослідне господарство «Сонячне» Інституту олійних культур;Рішення Запорізької обласної ради №10 від 27.11.1998р
14.  ;«Кучерявий»;заказник;ландшафтний;55,2;Новомиколаївський р-н, в межах земель Любицької сільської ради;Любицька сільська рада;Рішення Запорізької обласної ради від 25.12.2001р. №5
15.  ;«Фогельрейх»;заказник;ландшафтний;60;Куйбишевський р-н на околиці с.Вершина-2, в балці «Чумачка» і «Вовчий яр»;Фермерське господарство «Фогельрейх»;Розпорядження голови обласної держадміністрації від 9.07.1997р. №338
16.  ;«Балка Червоногорівська» (охоронна зона 30 м);заказник;ландшафтний;67,2;Новомиколаївський район, біля с.Іванівського, межує з полями кормового  сівозміну №1;Сторчівська сільська рада;Розпорядження Представника Президента України в Запорізькій області від 2.04.1992р. №321
17.  ;«Урочище Мамай гора»;заказник;ландшафтний;68;ДП «К-Дніпровське лісове господарство», Кам,янське лісництво, на південий звхід 2 км від с.Велика Знам,янка;ДП «К-Дніпровське лісове господарство»;Рішення Запорізького облвиконкому від 25.09.1984р. №315
18.  ;«Ставок із степовими ділянками» (охоронна зона 30 м);заказник;ландшафтний;69,2;Новомиколаївський район, на землях Терсянська сільська рада, біля поля №5;Терсянська сільська рада;Розпорядження Представника Президента України в Запорізькій області від 2.04.1992р. №321
19.  ;«Балка Мар’янівська» (охоронна зона 30 м);заказник;ландшафтний;71,3;Новомиколаївський район, с. Веселий гай;Веселогаївська сільська рада;Розпорядження Представника Президента України в Запорізькій області від 2.04.1992р. №321
20.  ;«Корсак-могила»;заказник;ландшафтний;76;Приморський р-н, с.Мануйлівка;Манойлівська сільська рада;Рішення Запорізького облвиконкому від 25.09.1984р. №315
21.  ;«Томаківський»;заказник;ландшафтний;78,7;Запорізький район, 2 км на захід від с.Ручаєвка;Дослідне господарство «Сонячне» Інституту олійних культур;Рішення Запорізької обласної ради №10 від 27.11.1998р
22.  ;«Урочище Жовта  круча»;заказник;ландшафтний;86;Орхівськке лісництво кв.36;ДП «Пологівське лісомисливське господарство»;Рішення Запорізького Облвиконкому від 17 серпня 1999 №7
23.  ;«Змішаний листяний ліс із залишками ковильно- типчакового степу»;заказник;ландшафтний;90;Кам’янко Дніпровський район, У границях землекористування радгоспу «Кам’янка», землі ДП «К-Дніпровське лісове господарство»;ДП «К-Дніпровське лісове господарство»;Розпорядження редставника Президента України від 31.12.1993р. №665
24.  ;Балка Різана;заказник;ландшафтний;90;Гуляйпільський район, на території Залізничної селищної ради, за 2 км на Захід від селища Залізничне;Гуляйпільська районна державна адміністрація;Рішення Запорізької обласної ради від 28.05.2009 № 8
25.  ;«Захисне лісове насадження на хвилястій місцевості»;заказник;ландшафтний;96;Токмакський р-н, Токмалське лісництво, кв.№16;ДП «Приморське лісове господарство»;Рішення Запорізького облвиконкому від 25.09.1984р. №315
26.  ;«Ізвестінський ставок»;заказник;ландшафтний;98;Веселівський р-н, в межах земель державного дослідного господарства «Ізвестія»;Державне дослідне господарство «Ізвестія»;Рішення Запорізького облвиконкому від 25.09.1984р. №315
27.  ;Вигін Чабанка;заказник;ландшафтний;103;Орхівськкий р-н, в межах земель Оріхівського лісництва кв.кв № 88, 89 ДП «Пологівське ЛМГ»;ДП «Пологівське ЛМГ»;Рішення Запорізького Облвиконкому від 17 серпня 1999 №7
28.  ;«Балка Ручаївська»;заказник;ландшафтний;112,6;Запорізький р-н, 100 м на південий схід від с.Ручаївка;Дослідне господарство «Сонячне» Інституту олійних культур;Рішення Запорізької обласної ради №10 від 27.11.1998р
29.  ;«Цілинна ділянка з ставками»;заказник;ландшафтний;113,4;Гуляйпольський рн, Дорожнянська сільська рада;Дорожнянська сільська рада;Рішення Запорізької обласної ради від 27.11.1998р. №10
30.  ;«Балка Панютинська»;заказник;ландшафтний;117;Оріхівський р-н, межує з землями фермерського господарства Махнорило Н.Ф.;Омельницька сільська рада;Рішення Запорізької обласної ради від 27.11.1998р. №10
31.  ;«Юрковський лиман»;заказник;ландшафтний;128,85;Оріхівський р-н, на північно-захід від с.  Юрківка;ДП «Пологівське лісомисливське господарство»;Рішення Запорізької обласної ради від 24.12.2002р. №12
32.  ;«Верхів,я балки Канцерівська»;заказник;ландшафтний;135,1;Запорізький р-н, 600 м від межі залізничої станції «Верхня Хортиця»;Дослідне господарство «Сонячне» Інституту олійних культур;Рішення Запорізької обласної ради №10 від 27.11.1998р
33.  ;«Грунтозахисне лісонасадження»;заказник;ландшафтний;140;Токмакський р-н, північно-західна околиця м.Токмак, Токмакське лісництво, кв.№19;ДП «Приморське лісове господарство»;Рішення Запорізького облвиконкому від 25.09.1984р. №315
34.  ;«Заплава р. Чингул»;заказник;ландшафтний;154;Токмакський район, розташований в межах земель Жовтневої сільської ради Токмацького району та Токмацького лісництва Державного підприємства «Приморське лісове господарство».;Жовтнева сільська радаТокмацького району, ДП «Приморське лісове господарство».;Організовано за рішенням Запорізької обласної ради від 29.12.2004 № 19
35.  ;«Цілинна лощина з ярами»;заказник;ландшафтний;185,8;Оріхівський р-н, в межах земель Омельницької сільської ради;Омельницька сільська рада;Рішення Запорізького Облвиконкому від 17 серпня 1999 №7
36.  ;«Степанівська коса»;заказник;ландшафтний;200;Приазовський р-н, поблизу с.Степанівка, між Азовським морем і Степанівською затокою Молочного лиману;Степанівська сільська рада, Мелітопольський педагогічний інститут;Рішення Запорізького облвиконкому від 13.09.1988р. №272
37.  ;«Ґрунтозахисне лісонасадження»;заказник;ландшафтний;210;Запорізький р-н, вздовж правого берега р.Дніпро, біля с.Федорівка, кв. 48, 49 Хортицького лісництва;Хортицьке лісництво, ДП «Запорізьке лісомисливське господарство»;Рішення Запорізького облвиконкому від 25.09.1984р. №315
38.  ;«Водосховище з лісонасадженнями навколо»;заказник;ландшафтний;215;На північ від с.Коларівка, Приморське лісництво кв.№ 3-4;ДП «Приморське лісове господарство»;Рішення Запорізького облвиконкому від 25.09.1984р. №315
39.  ;«Оголовок Бердянської коси»;заказник;ландшафтний;221;Бердянський р-н, м.Бердянськ, оголовок Бердянської коси з прилеглою акваторією Бердянської затоки;Бердянська міська рада;Рішення Запорізької обласної ради від 27.11.1998р. №10
40.  ;«Кам’янський лісовий масив» ;заказник;ландшафтний;239;ДП «К-Дніпровське лісове господарство», Кам,янське лісництво,.кв.№№ 3-103га, 4-54га, 5-82га;ДП «К-Дніпровське лісове господарство»;Рішення Запорізької обласної ради №10 від 27.11.1998р
41.  ;«Лісовий масив вздовж лівого берега р. Дніпро»;заказник;ландшафтний;250;Вільнянський р-н, вздовж лівого берега р.Дніпро від с.Петро-Михайлівка до межі з Дніпропетровською обл., лісові кв. 1 - 4;Михайлівське лісництво ДП «Запорізького лісомисливського господарства»;Рішення Запорізького облвиконкому від 25.09.1984р. №315
