№ з.п.;Назва території чи об’єкта ПЗФ;Категорія ;Тип;Площа, га;Місце розташування  території чи об`єкту ПЗФ;Назва установи, підпрємства, організації, землекористувача (землевласника), у віданні якого знаходиться територія чи об’єкт ПЗФ;Рішення, згідно з яким створено (змінено) дану територію чи об’єкт ПЗФ
Території та об`єкти ПЗФ загальнодержавного значення;;;;;;;
1.;«Кам’яні могили» (частина ПЗ Український степовий – Донецька обл.);природний заповідни;;100;Куйбишевський р-н, Шевченківська сільська рада, по кордону з Донецькою областю;Академія наук України;Постанова Ради Міністрів України від 08.05.1964р. №451
;Всього природних заповідників;0;;100;;;
1;«Великий Луг»;національний природний парк;;16756;Василівський район, м. Дніпрорудне, с. Скельки, Маячка, акваторія Каховського водосховища;Адміністрація НПП;Указ Президента України від 10.08.2006 № 121/2006
2;«Приазовський національний природний парк»;національний природний парк;;78126,92;Бердянський, Мелітопольський, Приазовський райони, міста Бердянськ та Мелітополь;Адміністрація НПП;Указ Президента України від 10.02.2010 №154/2010
;Всього національних природних парків;2;;94882,92;;;
1;«Молочний лиман»;заказник;гідрологічний;19000;Якимівський, Мелітопольський, Приазовський райони;Райдержадміністрації відповідних районів;Постанова Ради МіністрівУкраїни від 28.10.1974р. №500 повністю увійшов до складу Приазовського НПП
1;Разом заказників гідрологічних;1;;19000;;;
1;«Дніпровські пороги»;заказник;загальногеологічний;1383;м. Запоріжжя, о.Хортиця, о.Байда та скелі посеред р.Дніпро;Національний заповідник «Хортиця»;Постанова Ради МіністрівУкраїни від 28.10.1974р. №500
;Разом заказників загальногеологічних;1;;1383;;;
1;«Алтагірський»;заказник;загальнозоологічний;950;Якимівський р-н, околиця с.Радивонівка, Богатирське лісництво, кв. від 1 до 117,  без кв. 33, 40, 47, 54, 61;ДП «Мелітопольське лісомисливське господарство»;Постанова Ради МіністрівУкраїни від 28.10.1974р. №500
1;Разом заказників загальнозоологічних;1;;950;;;
1;«Старобердянський»;заказник;ландшафтний;993;Мелітопольський р-н с.НовоПилипівка по лівому березі р.Молочна;ДП «Мелітопольське лісомисливське господарство»;Ради МіністрівУкраїни від 28.10.1974р. №500, Рішення Запорізької облради від 25.07.1989 № 205 (зміна площі)
2;«Заплава р.Берда»;заказник;ландшафтний;1416,9;Бердянська міська рада  - 564,6 га, ДП «Бердянське лісове господарство» - 620 га, Нововасилівська с/р - 232,3 га;Бердянська міська рада, ДП «Бердянське лісове господарство», Нововасилівська с/р;Указ Президента України від 10.12. 1994р. №750/94 частково увійшов до складу Приазовського НПП
3;«Сівашик»;заказник;ландшафтний;2800;Якимівський р-н на Схід від с.Атманай;Атманайська сільська рада народних депутатів Якимівського р-ну;Указ Президента України від 20.08.1996р. №715/96 повністю увійшов до складу Приазовського НПП
4;«Коса Федотова»;заказник;ландшафтний;1910;Якимівський р-н, на захід від с.м.т. Кирилівка, півострів Азовського моря;Кирилівська сільська рада народних депутатів Якимівського р-ну;Указ Президента України від 20.08.1996р. №715/96 повністю увійшов до складу Приазовського НПП
5;«Коса Обіточна»;заказник;ландшафтний;8863;Приморський р-н, Приморське лісництво ДП «Приморське ЛГ», кв. № 1-56;ДП «Приморське ЛГ»;Постанова Ради Міністрів України від 11.09.1980 № 524
6;«Крутосхили  Каховського водосховища» (522,2 га);заказник;ландшафтний;522,2;Василівський р-н,Василівська райрада - 270,2га, Запорізке обласне управління лісового та мисливського господарства - 192го кв. кв. 17 - 20, Скельківська    сільська  рада  -  60  га;Василівська райрада, Запорізке обласне управління лісового та мисливського господарств, Скельківська сільська рада;Указ Президента України від 21.02.2002р. № 167/2002 частково увійшов до складу НПП «Великий Луг»
7;«Урочище Білозірське»;заказник;ландшафтний;390;Кам’янсько Дніпровський р-н, АТ племзавод «Степной» 130га, АРК «Прибой»- 80га,ДП «Кам’янсько Дніпровське лісове господасртво» - 180га  14кв.;АТ племзавод «Степной», АРК «Прибой», Кам`янко-Дніпровський держлісгосп;Указ Президента Укрсїни від 21.02.2002р. №167/2002
7;Разом заказників ландшафтних;7;;16895,1;;;
1;«Радіонівський»;заказник;лісовий;370;Якимівський р-н, с.Радивонівка, правий берег Молочного лиману, Богатирське лісництво, кв. № 76 -108;ДП «Мелітопольське лісомисливське господарство»;Ради МіністрівУкраїни від 28.10.1974р. №500, Рішення Запорізької облради від 25.07.1989 № 205 (зміна площі)
1;Разом заказників лісових;1;;370;;;
1;«Великі і Малі Кучугури» (400 га);заказник;орнітологічний;400;Василівський р-н, Каховське водосховище, Василівське лісництво Запорізького держлісгоспу;ДП «Запорізьке лісомисливське господарство»;Постанова Ради Міністрів України від 28.10.1974р. №500 частково увійшов до складу НПП «Великий Луг»
;Разом заказників орнітологічних;1;;400;;;
12;Всього заказників загальнодержавного значення;12;;38998,1;;;
1;«Балка Бальчанська»;пам`ятка природи;ботанічна;28;Вільнянський р-н, біля с.Орловське і Ворварівка;Дніпровська с.р.;Розпорядження Ради Міністрів УРСР від 14.10.1975р. №780-Р
2;«Балка Россоховата»;пам`ятка природи;ботанічна;27;Вільнянський р-н, на північ від с.Ясинувате;Дніпровська с.р.;Розпорядження Ради Міністрів УРСР від 14.10.1975р. №780-Р
3;«Урочище Пристіни»;пам`ятка природи;ботанічна;17;Запорізький р-н, с.Григорівка;ДП «Запорізьке лісомисливське господарство»;Розпорядження Ради Міністрів УРСР від 14.10.1975р. №780-Р
3;Разом пам’яток природи ботанічних;3;;72;;;
1;«Камяна могила над р. Молочна»;пам`ятка природи;геологічна;15;Мелітопльський р-н 1 км від с.Терпіння;Національна Академія наук України;Постанова Ради міністрів від 7.08.1963р. №1180
2;«Гранітні скелі»;пам`ятка природи;геологічна;15;Бердянський р-н, в межах земель Миколаївської с/р;Миколаївська  с/р;Розпорядження Ради Міністрів УРСР від 14.10.1975р. №780-Р
2;Разом пам`яток природи геологічних;2;;30;;;
1;«Балка Скотовата»;;комплексна;30;Гуляйпольський р-н, по межі з Дніпропетровською областю;Новомиколаївська сільська рада;Розпорядження Ради Міністрів УРСР від 14.10.1975р. №780-Р
2;«Верхів’я Утлюкського лиману»;;комплексна;280;Якимівський р-н, с.Давидівка;Давидівська сільска рада;Указ Президента України від 20.08.1996р. №715/96 повністю увійшов до складу Приазовського НПП
2;Разом пам`яток природи комплексних;2;;310;;;
7;Всього пам’яток природи загальнодержавного значення;7;;412;;;
;«Парк ім. Горького»;парк-пам`ятка садово-паркового мистецтва;;31;м.Мелітополь, вул.Богдана Хмельницького;Дирекція парку;Постанова Ради Міністрів УРСР від 29.01.1960р. №105
;Всього  парків-пам'яток садово-паркового мистецтва;1;;31;;;
;Всього територій та об`єктів загальнодержавного значення;22;;134424,02;;;
Території та об`єкти місцевого значення;;;;;;;
1;«Панай»;регіональний ландшафтний парк;;1025;Василівський р-н;Дирекція НПП «Великий Луг»;Рішення Запорізької обласної ради від 27.11.1998р. №10
;Всього регіональних ландшафтних парків;1;;1025;;;повністю увійшов до складу НПП «Великий Луг»
1;«Золотий берег»;дендрологічний парк;;7,5;Якимівський р-н, Федотова коса, територія б/в «Золотий берег»;ТОВ «Селенга»;Організовано за рішенням №19 від 18.01.2006 року Запорізької обласної  ради
1;Всього дендрологічних парків;1;;7,5;;;
1;«Таврія»;;;290;Новомиколаївський район, в 2 км від с.Тернуватого;ЗАТ «ЗАЗ»;Розпорядження голови обласної державної адміністрації від 09.07.1997р. № 338
1;Всього зоологічних парків ;1;;290;;;
1.       ;«Цілинна ділянка»;заказник;ботанічний;0,5;Токмакський р-н, с.Заможне;Жовтнева сільська рада;Рішення Запорізького облвиконкому від 28.05.1980р. №253
2.       ;«Балка Пушинська»;заказник;ботанічний;1;Запорізький р-н, с.Біленьке;Біленьківська сільська рада;Рішення Запорізького облвиконкому від 28.05.1980р. №253
3.       ;«Цілинна балка»;заказник;ботанічний;1;Токмакський р-н, біля с.Жовтневе;Жовтнева сільська рада;Рішення Запорізького облвиконкому від 28.05.1980р. №253
4.       ;«Цілинна ділянка»;заказник;ботанічний;1;Чернігівський р-н, східна сторона с.м.т.Чернігівка;Чернігівська селищна рада;Рішення Запорізького облвиконкому від 28.05.1980р. №253
5.       ;«Троїцька балка»;заказник;ботанічний;1;Мелітопольський район, с.Терпіння, Старобердянське лісництво, кв.№ 83;ДП «Мелітопольске лісомисливське господарство»;Рішення Запорізького облвиконкому від 28.05.1980р. №253
6.       ;«Балка Вовча»;заказник;ботанічний;1,5;Запорізький р-н, с.Біленьке;Біленьківська сільська рада;Рішення Запорізького облвиконкому від 28.05.1980р. №253
7.       ;«Цілинна ділянка»;заказник;ботанічний;1,5;Запорізький р-н, околиця с.Смоляне, Крутоярівське лісництво, кв.28;Запорізьке обласне управління лісного та мисливського гоподарства;Рішення Запорізького облвиконкому від 28.05.1980р. №253
8.       ;«Балка «Голубовка» (охоронна зона 30 м);заказник;ботанічний;2;Новомиколаївський район, біля поля №8 сівообігу №1;Зеленівська сільська рада;Розпорядження Представника Президента від 2.10.1992р. №321
9.       ;«Цілинна ділянка»;заказник;ботанічний;2;Новомиколаївський район. с.Любицьке;Любицька сільська рада;Рішення Запорізького облвиконкому від 28.05.1980р. №253
10.   ;«Цілинні пришляхові смуги»;заказник;ботанічний;2;Гуляйпольський р-н біля с.Комсомольське;Комсомольська сільська рада;Рішення Запорізького облвиконкому від 28.05.1980р. №253
11.   ;«Балка Данилівська»;заказник;ботанічний;2;Гуляйпольський р-н с.Успенівка;Новомиколаївська сільська рада;Рішення Запорізького облвиконкому від 28.05.1980р. №253
12.   ;«Цілинна ділянка»;заказник;ботанічний;2;Гуляйпольський р-н с.Любимівка;Любимівська сільська рада;Рішення Запорізького облвиконкому від 28.05.1980р. №253
13.   ;«Цілинна ділянка»;заказник;ботанічний;2;Василівський р-н, набережна Каховського водосховища біля м.Дніпрорудного;Міськрада м.Дніпрорудний;Рішення Запорізького облвиконкому від 28.05.1980р. №253
14.   ;«Цілинна ділянка»;заказник;ботанічний;2;Бердянський р-н, околиця с.Карла Маркса;Карла Марксівська сільська рада;Рішення Запорізького облвиконкому від 28.05.1980р. №253
15.   ;«Берег старого русла р.Обіточна»;заказник;ботанічний;2;Приморський р-н, околиця м.При-морськ;Ногайський держаний агротехнічний технікум;Рішення Запорізького облвиконкому від 22.09.1982р. № 431
16.   ;«Цілинна ділянка»;заказник;ботанічний;2;Василівський р-н, біля с.Приморське;Приморська сільська рада;Рішення Запорізького облвиконкому від 28.05.1980р. №253
17.   ;«Балка Гончари» (охоронна зона 30 м);заказник;ботанічний;2,2;Новомиколаївський район, в польовому сівообігу №1, с. Веселий гай;Веселогаївська сільська рада;Розпорядження Представника Президента від 2.10.1992р. №321
18.   ;«Лісосмуга з підліском глоду»;заказник;ботанічний;2,3;Токмакський р-н, біля с. Жовтневе;Держплемзавод «Ударнік»;Рішення Запорізького облвиконкому від 28.05.1980р. №253
19.   ;«Балка Голубівка»;заказник;ботанічний;3;Новомиколаївський район, околиця с.Голубівка, біля кінського заводу;Запорізький кінзавод №86;Рішення Запорізького облвиконкому від 28.05.1980р. №253
20.   ;«Водянські і Іванівські Кічугури»;заказник;ботанічний;3;Кам’янсько Дніпровський р-н, околиця с.Водяне;Водянська сільська рада;Рішення Запорізького облвиконкому від 28.05.1980р. №253
21.   ;«Балка Трушевська»;заказник;ботанічний;3;Запорізький р-н, с.Біленьке;Біленьківська сільська рада;Рішення Запорізького облвиконкому від 28.05.1980р. №253
22.   ;«Цілинна ділянка»;заказник;ботанічний;3;Василівський р-н, біля с.м.т. Степногірськ;Степногірська селищна рада;Рішення Запорізького облвиконкому від 28.05.1980р. №253
23.   ;«Водоохоронна зона»;заказник;ботанічний;3;Чернігівський р-н, північий бік с.Кам’янка;Стульнівська сільська рада;Рішення Запорізького облвиконкому від 28.05.1980р. №253
24.   ;«Цілинна ділянка»;заказник;ботанічний;3;Пологівський р-н, біля с.Конські Роздори, водоохоронна зона р. Конки;Консько роздорська сільська рада;Рішення Запорізького облвиконкому від 28.05.1980р. №253
25.   ;«Шайтанова балка»;заказник;ботанічний;3;Бердянський р-н, біля с.Андровка;Долинська с/р;Рішення Запорізького облвиконкому від 28.05.1980р. №253
26.   ;«Захисна смуга»;заказник;ботанічний;3;Приазовський район, в межах земель с. Дунаївка;Дунаївська сільська рада (Приазовська РДА);Рішення Запорізького облвиконкому від 28.05.1980р. №253
27.   ;«Цілинна ділянка»;заказник;ботанічний;3,1;Пологівський р-н, поблизу с. Конські роздори;Консько роздорська сільська рада;Рішення Запорізької ради від 17.08.99р.№7
28.   ;«Урочище Церкви»;заказник;ботанічний;4;Чернігівський р-н, с.Могиляни;Чернігівська селищна рада;Рішення Запорізького облвиконкому від 28.05.1980р. №253
29.   ;«Правий берег Молочного лиману»;заказник;ботанічний;4;Якимівський р-н, околиця с.Шелюги;Шелюгівська сільська рада;Рішення Запорізького облвиконкому від 28.05.1980р. №253
30.   ;«Цілинна балка»;заказник;ботанічний;5;м.Запоріжжя, на околиці с.Малишевка;Українська дослідна станція олійних культур;Рішення Запорізького облвиконкому від 2.06.1987р. №207
31.   ;«Балка Виноградна»;заказник;ботанічний;5;Запорізький р-н, обласна сільськогосподарська дослідницька станція;Запорізька обласна дослідницька станція;Рішення Запорізького облвиконкому від 2.06.1987р. №207
32.   ;«Цілинна ділянка»;заказник;ботанічний;5;Василівський р-н, біля с.Кам’янське;Кам`янська с/р;Рішення Запорізького облвиконкому від 28.05.1980р. №253
33.   ;«Балка Янчур»;заказник;ботанічний;5;Куйбишевський р-н, с.Сміле;Смілівська сільська рада;Рішення Запорізького облвиконкому від 28.05.1980р. №253
34.   ;Ділянка «Ясне»;заказник;ботанічний;5;Василівський р-н, біля с.Ясна Поляна і с.Орлянське;Орлянська сільська рада;Рішення Запорізького облвиконкому від 28.05.1980р. №253
35.   ;«Балка Тупік»;заказник;ботанічний;5;Василівський р-н, околиця м.Василівка;Василівська міська рада;Рішення Запорізького облвиконкому від 28.05.1980р. №253
36.   ;«Правий берег Молочного лиману»;заказник;ботанічний;5;Якимівський р-н, с.Ленінське;Радивонівська сільська рада;Рішення Запорізького облвиконкому від 28.05.1980р. №253
37.   ;«Балка Домузгла»;заказник;ботанічний;5;Приазовський р-н, с.Добрівка,;Добрівська сільська рада;Рішення Запорізького облвиконкому від 28.05.1980р. №253
38.   ;«Цілинна ділянка»;заказник;ботанічний;5;Василівський р-н, біля с.Скельки;Скельківська сільська рада;Рішення виконкому Запорізької облради від 28.05.980 № 253
39.   ;«Балка з степовою рослинністю»;заказник;ботанічний;5,7;Кам’янко Дніпровський р-н, Заповітненська сільська рада;Заповітненська сільська рада;Рішення Запо-різького обл-виконкому від 9.10.1990р. №281
40.   ;«Балка безімена» (охоронна зона 30 м);заказник;ботанічний;5,7;Новомиколаївський район, на межі сівообігів №1 і №2;Різдвянівська сільська рада;Розпорядження Представника Президента від 2.10.1992р. №321
41.   ;«Цілинна ділянка Могили» (охоронна зона 30 м);заказник;ботанічний;6;Вільнянський р-н,  на північний захід від с.Терсянка;Привільненська сільська рада;Розпорядження Представника Президента від 2.10.1992р. №321
