№ з.п.;Назва території чи об’єкта ПЗФ;Категорія ;Тип;Площа, га;Місце розташування  території чи об`єкту ПЗФ;Назва установи, підпрємства, організації, землекористувача (землевласника), у віданні якого знаходиться територія чи об’єкт ПЗФ;Рішення, згідно з яким створено (змінено) дану територію чи об’єкт ПЗФ
Території та об`єкти ПЗФ загальнодержавного значення;;;;;;;
; «Горгани»;Природний заповідник;;5344,2;Надвірнянський район,  Бистрицька та Зеленська сільські ради;Міністерство еколгії  та природних ресурсів України;Указ Президента України   від 12.09.1996 р.   № 831/96
;Всього природних заповідників;1;;5344,2;;;
;Карпатський;національний природний парк;;50495;Яремчанська міська рада;Міністерство еколгії  та природних ресурсів України;Постанова РМ УРСР від 03.06.1980 р. № 376
;«Гуцульщина»;національний природний парк;;32271;Косівський район;Міністерство еколгії  та природних ресурсів України;Указ Президента України   від 14.05.2002 р.   № 456/2002
;Галицький;національний природний парк;;14684,8;Галицький район;Держкомлісгосп України;Указ Президента України   від 09.08.2004 р.   № 877/2004
;«Синьогора»;національний природний парк;;10866;Богородчанський район;;Указ Президента України   від 21.12.2009р.   № 1083/2009
;«Верховинський»;національний природний парк;;12022,9;Верховинський район;Міністерство еколгії  та природних ресурсів України;Указ Президента України   від 22.01.2010 р.   № 58/2010
;Всього національних природних парків;5;;120339,7;;;
; «Грофа»;заказник ;ландшафтний;2533,8;"Рожнятівський район,  Довгополянське   лісництво,кв.21,36,38;  Менгільське лісництво, кв.8,13,22,23,26; Осмолодське лісництво, кв.30,31,36;  Різарнянське лісництво, кв.12;  Піскавське лісництв, кв.39";ДП «Осмолодський держлісгосп»;Указ Президента України   від 20.08.1996 р.   № 715/96
; «Козакова долина»;заказник ;ландшафтний;953;Тисменицький район,  Дністровське лісництво, кв.3-16;ДП «Івано-Франківський держлісгосп»;Постанова РМ УРСР від 16.12.1982 р. № 617
;Разом заказників ландшафтних;2;;3486,8;;;
; «Урочище «Скит Манявський»;заказник ;лісовий;362;Богородчанський район,  Манявське лісництво,   кв. 32-37;ДП «Солотвинський держлісгосп»;Постанова РМ УРСР від 16.12.1982 р. № 617
; «Бредулець-кий»;заказник ;лісовий;106;"Надвірнянський район,  Зеленське лісництво,   кв.5, вид.1-6; 8-23; 25";ДП «Надвірнянський держлісгосп»;Постанова РМ УРСР від 28.10.1974 р.№ 500
;Разом заказників лісових;2;;468;;;
; «Яйківський»;заказник ;ботанічний;263;Рожнятіваський район,  Мшанське лісництво,   кв.35, вид.1-71;ДП «Осмолодський держлісгосп»;Постанова РМ УРСР від 28.10.1974 р. № 500
; «Тавпишир-ківський»;заказник ;ботанічний;424;Надвірнянський район,  Бистрицьке лісництво,   кв. 36,39,53,57;ДП «Надвірнянський держлісгосп»;Постанова РМ УРСР    від 28.10.1974 р.№ 500
; «Кливський»;заказник ;ботанічний;111,5;"Надвірнянський район,  Любіжнянське лісництво,   кв.20, вид.4-8;  12-17; 24 -28; 30; 31; 33-38";ДП «Делятинський держлісгосп»;Постанова РМ УРСР від 28.10.1974 р. № 500
; «Княждвірсь-кий»;заказник ;ботанічний;208;Коломийський район,  Печеніжинське лісництво   кв.1-3,6,7  ;ДП «Коломийський держлісгосп»;Постанова РМ УРСР від 28.10.1974 р. № 500
;Разом заказників ботанічних;4;;1006,5;;;
;«Пожератульський»;заказник;орнітологічний;207,5;"Надвірнянський район,  Поляницьке лісництво, кв.35, вид. 2, 8, 10, 11; кв.36, вид. 4, 5, 6, 9; кв. 37, вид.1-6, 12-17, кв. 38, вид.18, 19, 22, 29";ДП «Делятинський держлісгосп»;Постанова РМ УРСР від 28.10.1974 р. № 500 (внесені зміни Постановою РМ УРСР   № 5 від 07.01.1985 р.)
;Разом заказників орнітологічних;1;;207,5;;;
;«Турова дача»;заказник;гідрологічний;255;Рожнятівський район,  Краснянське лісництво, кв. 8,9,10;ДП «Осмолодський держлісгосп»;Постанова РМ УРСР від 28.10.1974 р.№ 500
;Разом заказників гідрологічних;1;;255;;;
;Всього заказників загальнодержавного значення;10;;5423,8;;;
; «Скелі Довбуша»;пам`ятка природи;комплексна;100;Долинський район,  Поляницьке ллісництво, кв. 9,14;ДП «Болехівський держлісгосп»;Постанова РМ УРСР від 30.03.1981 р. № 145
; «Урочище  «Верхнє Озерище»;пам`ятка природи;комплексна;48;"Надвірнянський район,  Річанське лісництво, кв.20, вид.23-33; кв. 23, вид.32-34, кв.24, вид. 1";ДП «Надвірнянський держлісгосп»;Розпорядження РМ УРСР від 14.10.1975 р. № 780-р
;«Касова гора»;пам`ятка природи;комплексна;65;Голицький район  с. Бовшів;Бовшівська сільська рада;Розпорядження РМ УРСР від 14.10.1975 р. № 780-р
;Разом пам`яток природи комплексних;3;;213;;;
; «Урочище  Масьок»;пам`ятка природи;ботаннічна;18;Городенківський район,   с. Острівець;Острівецька сільська рада;Розпорядження РМ УРСР від 14.10.1975 р.   № 780-р
; «Чортова гора»;пам`ятка природи;ботаннічна;13;"Рогатинський район  село Підвиння   (9,5 га);  село Пуків (3,5 га)";"Підвиннянська сільська рада;    Пуківська сільська рада";Розпорядження РМ УРСР від 14.10.1975 р. № 780-р
; «Урочище «Осій»;пам`ятка природи;ботаннічна;13,5;Долинський район,  Мало-Тур’янське  лісництво, кв.2, вид. 33, 34, 37, 38, 39, 40;ДП «Вигодський держлісгосп»;Розпорядження РМ УРСР від 14.10.1975 р. № 780-р
; «Урочище  «Сокіл»;пам`ятка природи;ботаннічна;29;"Рожнятівський район,  Ангелівське лісництво, кв. 34, вид.9-16, 22, 23, 27, 35-37; кв.35, вид 1, 4, 6";ДП «Осмолодський держлісгосп»;Розпорядження РМ УРСР від 14.10.1975 р. № 780-р
;«Урочище «Тарниці»;пам`ятка природи;ботаннічна;60;Надвірнянський район,  Микуличинське   лісництво, кв. 20, вид. 1- 3, 6, 12, 14, 18, 19, 20;ДП «Делятинський держлісгосп»;Розпорядження РМ УРСР від 14.10.1975 р. № 780-р
;Разом пам`яток природи ботанічних;5;;133,5;;;
; «Болото  Висяче»;пам`ятка природи;гідрологічна;0,5;Верховинський район,  Буркутське лісництво, кв. 37, вид. 25;ДП «Верховинський держлісгосп»;Розпорядження РМ УРСР від 14.10.1975 р. № 780-р
;«Болото  «Ширковець»;пам`ятка природи;гідрологічна;12;Долинський район   Мізунське лісництво, кв.13, вид.18;ДП «Вигодський держлісгосп»;Розпорядження РМ УРСР від 14.10.1975 р. № 780-р
; «Болото  «Лисак»;пам`ятка природи;гідрологічна;14,4;"Долинський район  Свічівське лісництво, кв. 12, вид.20; кв. 15, вид. 2, 3 ,6, 8, 10, 11";ДП «Вигодський держлісгосп»;Розпорядження РМ УРСР від 14.10.1975 р. № 780-р
; «Болото  «Мшана»;пам`ятка природи;гідрологічна;6;Рожнятівський район,  Мшанське лісництво, кв.33, вид. 101,102;ДП «Осмолодський держлісгосп»;Розпорядження РМ УРСР від 14.10.1975 р. № 780-р
;Разом пам`яток природи гідрологічних;4;;32,9;;;
;«Старуня»;пам`ятка природи;геологічна;60;Богородчанський район,  село Старуня;Старунська сільська рада;Постанова РМ  УРСР від 21.03.1984 р. № 139
;Разом пам`яток природи геологічних;1;;60;;;
;Всього пам`яток природи загальнодержавного значення;13;;439,4;;;
;«Високогір-ний»;дендрологічний парк;;124;Надвірнянський район,  Бистрицьке лісництво, кв.62;ДП «Надвірнянський держлісгосп»;Постанова РМ УРСР від 22.07.1983 р. № 311
;«Діброва»;дендрологічний парк;;8;Богородчанський район,  Богородчанське   лісництво, кв.27;ДП «Солотвинський держлісгосп»;Постанова РМ УРСР від 22.07.1983 р. № 311
;«Дружба»;дендрологічний парк;;10;Тисменицький район,  с. Угринів  Івано-Франківська міська рада;Прикарпатський держуніверситет ім. В. Стефаника;Постанова РМ УРСР від 22.07.1983 р. № 311
;Всього дендрологічних парків загальнодержавного значення;3;;142;;;
;«Парк партизанської слави»;парк-пам’ятка садово-паркового мистецтва;;7;Надвірнянський район,  Зарічанське лісництво, кв.24;ДП «Делятинський держлісгосп»;Постанова Держкомітету УРСР з охорони природи від 17.08.1983 р. № 37
;Всього парків-пам`яток садово-паркового мистецтва загальнодержавного значення ;1;;7;;;
;Всього територій та об`єктів ПЗФ загальнодержавного  значення   ;33;;131696,1;;;
Території та об`єкти місцевого значення;;;;;;;
;Дністровський;регіональний ландшафтний парк;;19656;Городенківський  район,  Тлумацький  район  вздовж ріки Дністер;Городенківська, Тлумацька районні ради;Рішення сесії обласної ради від 15.07.93 р.
;«Гуцульщина»;регіональний ландшафтний парк;;17729;Косівський район;Косівська районна рада, Кутський держлісгосп, Косівський МГЛ;Розпорядження облдержадміністрації від 23.06.97 р. № 443
;Поляницький;регіональний ландшафтний парк;;1032;Долинський район,  Поляницьке лісництво  вк.9,10,14-16,22-26;ДП «Болехівський держлісгосп»;Розпорядження облдержадміністрації від 15.07.96 р.  № 451
;Всього регіональних ландшафтних парків;3;;38417;;;
;«Чивчино-Гринявський»;заказник;ландшафтний;7243;Верховинський район, Чивчинське лісництво, кв. 11, 13-16, 24, 26-42  Буркутське лісництво, кв.14-19,23-25, 32-35    Паркалабське лісництво, кв.8,9,14,16-20  .  Полонини: «алузька», «Прелуки», «Ретундул», «Лустун», «Мале Пір’є», «Попадя»,»Гнітеса», «Чивчин», «Штевйора»  ;ДП «Верховинський держлісгосп», ДП «Гринявський держлісгосп», Верховинська районна рада;Розпорядження облдержадміністрації від 23.06.97 р. № 443
;«Ріка Свіча з притокою Мізунькою»;заказник;ландшафтний;5940;Долинський район;Долинська районна рада, сільські ради;Рішення обласної ради від 15.07.93 р.
;«Саджавський»;заказник;ландшафтний;328,6;Долинський район, межиріччя рр. Свічі та Саджави;Княжелуцька сільська рада;Рішення обласної ради від 15.07.93 р.
;«Цапове»;заказник;ландшафтний;6;Долинський район, Церківнянське лісництво, кв.8, вид 38;Болехівський держлісгосп;Розпорядження облдержадміністрації від 15.07.93 р. № 451
;«Яськів потік»;заказник;ландшафтний;20;Калуський район, Войнилівське лісництво, кв.1,вид.1,3,5,6,16,17;Калуський держлісгосп;Рішення обласної ради від 15.07.93 р.
;«Ріка Лімниця з водоохоронною смугою вздовж берегів шириною 100 м»;заказник;ландшафтний;2064;Калуський район  Рожнятівський  район;Калуська, Рожнятівська районні ради;Рішення облвиконкому від 15.01.79 р. № 13
;«Негрова»;заказник;ландшафтний;47;Надвірнянський район, Бистрицьке лісництво, кв. 1, вид 1;ДП «Надвірнянське лісове господарство»;Рішення обласної ради від 17.01.08 № 490-18/2008
;«Фарфанянка»;заказник;ландшафтний;58;"Надвірнянський район, Довбушанське лісництво,  кв. 20, вид. 4; кв. 21, вид. 10";ДП «Надвірнянське лісове господарство»;Рішення обласної ради від 17.01.08 № 490-18/2008
;«Бовкоти»;заказник;ландшафтний;2,2;Долинський район  с. Станківці;Долинський район  с. Станківці;Рішення обласної ради від 17.01.08 № 490-18/2008
;«Грегіт»;заказник;ландшафтний;310;Косівський район,  Космацьке лісництво,  кв.27,29  ;ДП «Кутське лісове господарство»;Розпорядження облдержадміністрації від 15.07.96 р. № 451
;«Кам’янистий хребет»;заказник;ландшафтний;30;"Косівський район,  Косівське лісництво,  кв.18, вид. 1,14,16,25,36; кв. 19, вид. 3,4,8,11,16,20  ";ДП «Кутське лісове господарство»;Розпорядженням облдержадміністрації від 15.07.96 р. № 451
;Разом заказників ландшафтних;11;;16048,8;;;
;«Урочище «Погорілець»;заказник;лісовий;220,5;"Богородчанський район, Гутянське лісництво, кв. 45, вид. 1-18; кв. 46, вид. 1-6, 11, 14, 17, 19-24; кв. 47, вид. 13, 15, 16; кв. 48, вид. 1, 2, 9";ДП «Солотвинський держлісгосп»;Рішення обласної ради від 12.03.04 р.   № 350-10/2004
;«Урочище «Комарники»;заказник;лісовий;175;"Богородчанський район, Манявське лісництво, кв. 9, вид. 41-44; кв. 10, вид. 25-29; кв. 11, вид. 26, 27, 29-31; кв. 12, вид. 11-15; кв. 13, вид. 19-30; кв. 14, вид. 13-20; кв. 15, вид. 17, кв. 19, вид. 13, кв. 20, вид. 1-8";ДП «Солотвинський держлісгосп»;Рішення обласної ради від 12.03.04 р.   № 350-10/2004
;«Урочище «Шиворіс»;заказник;лісовий;50;"Богородчанський район, Яблунське лісництво, кв. кв. 36, вид. 16,17; кв. 37, вид. 11,13; кв. 38, вид. 12-15; кв. 39, вид. 12-18";ДП «Солотвинський держлісгосп»;Рішення обласної ради від 12.03.04 р.   № 350-10/2004
;«Урочище «Сумарин»;заказник;лісовий;185;"Богородчанський район, Яблунське лісництво, кв. 17, вид. 1-7; кв. 18, вид. 1-5; кв. 20, вид. 1-2; кв. 21, вид. 1-6; кв. 22, вид. 1-2; кв. 24, вид. 1-16; кв. 23, вид.1-7";ДП «Солотвинський держлісгосп»;Рішення обласної ради від 12.03.04 р.   № 350-10/2004
;«Марино»;заказник;лісовий;763;Долинський район, Церківнянське лісництво,  кв.37-39, 43-47;ДП «Болехівський держлісгосп»;Рішення обласної ради від 28.12.99 р.  № 237-11/99
;«Ільма»;заказник;лісовий;3294;Долинський район, Ілем’янське лісництво, кв. 1-23;ДП «Вигодський держлісгосп»;Рішення облвиконкому від 16.10.84 р. № 247
;«Страгора»;заказник;лісовий;840;Надвірнянський район, Надвірнянське лісництво, кв.46-51;ДП «Надвірнянський держлісгосп»;Рішення облвиконкому від 16.09.80 р. № 335
;«Красна»;заказник;лісовий;510;Надвірнянський район, Надвірнянське лісництво, кв.30-37;ДП «Надвірнянський держлісгосп»;Рішення облвиконкому від 16.09.80 р. № 335
;«Потоки»;заказник;лісовий;153,3;Надвірнянський район, Надвірнянське лісництво, кв.2, вид. 1-23, кв.3, вид.1-13, кв.5, вид.1-6, кв.6, вид.4, 6-8, 10, 10-16;ДП «Надвірнянський держлісгосп»;Розпорядження облдержадміністрації від 15.07.96 р., зміни у площі згідно рішення обласної ради від 14.09.2004 р. № 445-12/2004 “Про зміну меж територій та об’єктів природно – заповідного фонду області”
;«Журавенків-ський»;заказник;лісовий;48;Рогатинський район, Букачівське лісництво, кв.28, вид. 1, 2;ДП «Рогатинський держлісгосп»;Розпорядження ОДА від 15.07.1996 р. № 451
;«Журитин»;заказник;лісовий;50,9;Рогатинський район, Пуківське лісництво, кв.2, вид. 7-10;ДП «Рогатинський держлісгосп»;Розпорядження облдержадміністрації   від 15.07.96 р. № 451
;«Каменець»;заказник;лісовий;184;Косівський район,  Кутське лісництво, кв. 24;ДП «Кутське лісове господарство»;Розпорядження облдержадміністрації   від 15.07.96 р. № 451
;«Терношори»;заказник;лісовий;10;Косівський район,  Яворівське лісництво, кв. 26  ;Косівський міжгосподарський лсгосп;Розпорядження облдержадміністрації   від 15.07.96 р. № 451
;Разом заказників лісових;13;;6483,7;;;
;«Щавнянська Магура»;заказник;ботанічний;253,6;"Болехівська міська рада, Козаківське лісництво, кв. 30, вид. 1-6, 8-12, 14-16; кв. 31, вид. 1-3, 5-10, 14-18, 20-25, 31-34; кв. 32, вид. 6-10, 14-16";Болехівська сільська рада;Рішення обласної ради від 12.03.04 р.   № 350-10/2004
;«Магура»;заказник;ботанічний;130,3;Болехівська міська рада, Козаківське лісництво,  кв.31, вид.4, 11-13, 19, 26-30, 35-42 ,  кв. 32, вид.1-5, 11-13, 17;ДП «Болехівський держлісгосп»;Рішення обласної ради від 28.12.99 р.№ 237-11/99
;«Федів»;заказник;ботанічний;121;Болехівська міська рада, Козаківське л-во кв.18;ДП «Болехівський держлісгосп»;Рішення обласної ради від 28.12.99 р.№ 237-11/99
;«Жидовець»;заказник;ботанічний;41,4;Долинський район, Витвицьке лісництво, кв. 2, вид.1-7, 9, 13;ДП «Болехівський держлісгосп»;Рішення обласної ради від 12.03.04 р.   № 350-10/2004
;«Могила»;заказник;ботанічний;1,88;Городенківський район, село Ясенів-Пільний;Ясенів-Пільнянська сільська рада;Рішення облвиконкому від 19.07.88 р. № 218
;«Підбавки»;заказник;ботанічний;0,12;Городенківський район, село Ясенів-Пільний;Ясенів-Пільнянська сільська рада;Рішення облвиконкому від 19.07.88 р. № 218
;«Обертинська долина»;заказник;ботанічний;29;Городенківський район, село Чортовець;Чортовецька сільська рада;Рішення обласної ради від 15.07.93 р.
;«Вістова»;заказник;ботанічний;27,5;Калуський район,  Калуське лісництво,  кв. 31,   вид. 1, 1.1, 2, 2.1, 3, 5;ДП «Калуський держлісгосп»;Рішення обласної ради від 15.07.93 р. із змінами у площі відповідно до рішення обласної ради від 17.01.08 № 490-18/2008
;«Ліскувата»;заказник;ботанічний;23;Яремчанська міська рада,  Дорівське лісництво, кв.10,  вид. 3, 4, 6-8, 10;Яремчанська міська рада, ДП «Делятинський держлісгосп»;Рішення облвиконкому від 17.05.83 р. № 166
