;«Діл»;заказник;ботанічний;3,4;Надвірнянський район, Зарічанське лісництво, кв.18, вид. 20;ДП «Делятинський держлісгосп»;Рішення облвиконкому від 17.05.83 р. № 166
;«Поляниця»;заказник;ботанічний;2;Яремчанська міська рада, Поляницьке лісництво, кв. 8, вид. 8;ДП «Делятинський держлісгосп»;Рішення облвиконкому від 17.05.83 р. № 166
;«Санковичі»;заказник;ботанічний;41,7;Яремчанська міська рада;Яремчанська міська рада;Рішення облвиконкому від 17.05.83 р. № 166
;«Річанський»;заказник;ботанічний;48;Надвінянський район, Річанське лісництво, кв. 20, вид. 18,  20;ДП «Надвірнянський держлісгосп»;Рішення облвиконкому від 17.05.83 р. № 166
;«Голубічка»;заказник;ботанічний;11;Надвірнянський район, Річанське лісництво,  кв. 4, вид. 16;ДП «Делятинський держлісгосп;Рішення облвиконкому від 19.07.88 р. № 128
;«Копчин»;заказник;ботанічний;422;Яремчанська міська рада, Поляницьке лісництво,  кв. 21-24;ДП «Делятинський держлісгосп»;Рішення облвиконкому від 19.07.88 р. № 128
;«Білославсь-кий»;заказник;ботанічний;8;Надвірнянський район, с. Чорні Ослави;Чорноославська сільська рада;Рішення облвиконкому від 17.05.83 р. № 166
;«Бубонець»;заказник;ботанічний;25;Рогатинський район, с. Загір’я;Княгиницька сільська рада;Рішення обласної ради від 28.12.99 р.№ 237-11/99
;«Конвалія»;заказник;ботанічний;63,3;Рожнятівський район, Рожнятівське лісництво,  кв. 2, вид.1, 2 , кв. 3, вид. 3, 7;Брошнівський держлісгосп;Рішення облвиконкому від 19.07.88 р. № 128
;«Іванків»;заказник;ботанічний;15;Снятинський район, с. Трійця;Трійцівська сільська рада;Рішення облвиконкому від 19.07.88 р. № 128
;«Хомів»;заказник;ботанічний;35;Снятинський район, с. Іллінці;Іллінцівська сільська рада;Рішення облвиконкому від 19.07.88 р. № 128
;«Урочище «Лупені»;заказник;ботанічний;8,9;Снятинський район, Заболотівське лісництво, кв. 23, вид. 17-19,  кв. 24, вид. 1-4;Коломийський держлісгосп;Рішення обласної ради від 15.07.93
;«Пугачівка»;заказник;ботанічний;4;Тлумацький район, с. Герасимівка;Герасимівська сільська рада;Рішення обласної ради від 15.07.93
;«Меленещина»;заказник;ботанічний;2;Тлумацький район, с. Палагичі;Палагицька сільська рада;Рішення обласної ради від 15.07.93
;Разом заказників ботанічних;23;;1317,1;;;
;«Ріка Чорний Черемош з прибережною смугою»;заказник;гідррологічний;1740;Верховинський район;Верховинська селищна рада;Розпорядження облдержадміністрації від 15.07.96 р. № 451
;«Ріка Пістинька з прибережною смугою»;заказник;гідррологічний;275;  Коломийський район; Коломийська райдержадміністрація;Розпорядження облдержадміністрації від 15.07.96 р. № 451
;«Ріка Пістинька з прибережною смугою»;заказник;гідррологічний;845;Косівський район;Косівська райдержадмінстрація;Розпорядження облдержадміністрації від 15.07.96 р. № 451
;«Ріка Рибниц з прибережною смугою»;заказник;гідррологічний;1080;Косівський район;Косівська райдержадмінстрація;Розпорядження облдержадміністрації від 15.07.96 р. № 451
;«Під Верховиною»;заказник;гідррологічний;27;Рогатинський район, с. Княгиничі;Княгиницька сільська рада;Рішення обласної ради від 28.12.99 р. № 237 – 11/99
;«Болото»;заказник;гідррологічний;6;Рогатинський район, с. Добринів;Добринівська сільська рада;Рішення обласної ради від 28.12.99 р. № 237 – 11/99
;Разом заказників гідрологічних;5;;3973;;;
;«Шевченківсь-кий»;заказник;орнітологічний;3;Долинський район, Шевченківське лісництво,  кв.9, вид.24;ДП «Вигодський держлісгосп»;Розпорядження облдержадміністрації від 15.07.96 р. № 451
;«Чотири ясени»;заказник;орнітологічний;1,8;Долинський район, Шевченківське лісництво,  кв.9, вид.24;ДП «Болехівський держлісгосп»;Рішення обласної ради від 12.03.2004.   №350-10/2004
;«Бурсуків»;заказник;орнітологічний;4;Болехівська міська рада, Болехівське лісництво, кв.50, вид.33;ДП «Болехівський держлісгосп»;Рішення обласної ради від 12.03.2004.   №350-10/2004
;«Погорілець»;заказник;орнітологічний;11,2;Болехівська міська рада, Болехівське лісництво, кв.29, вид.6;ДП «Болехівський держлісгосп»;Рішення обласної ради від 12.03.2004.   №350-10/2004
;«Підбавки»;заказник;орнітологічний;1,9;Городенківський район  с. Ясенів-Пільний;с. Ясенів-Пільний;
;Разом заказників орнітологічних;5;;21,9;;;
;«Чорний ліс»;заказник;загальнозоологічний;15081,74;Тисменицький, Калуський,  Богородчанський район;ПП «СЛНДПЗГ «Чорний ліс», ЛПК МО України;Рішення сесії обласної ради від 23.06.97 р.   № 443 із змінами у площі згідно рішення обласної ради від 14.09.2004 р. № 445-12/2004 “Про зміну меж територій та об’єктів природно – заповідного фонду області”
;«Гирява»;заказник;загальнозоологічний;39,1;Болехівська міська рада, Козаківське лісництво, кв. 33, вид.14,15;ДП «Болехівський держлісгосп»;Рішення обласної ради від 28.12.99 р.  № 237 – 11/99
;Разом заказників загальнозоологічних;2;;15120,84;;;
;Всього заказників місцевого значення;59;;42965,34;;;
;«Каменець»;пам`ятка природи;комплексна;1;Верховинський район, Чивчинське ліснитво, кв.9, вид.19;ДП «Верховинський держлісгосп»;Рішення облвиконкому від 16.09.80 р. № 335
;«Озірна»;пам`ятка природи;комплексна;0,7;Надвірнянський район, Довжинецьке лісництво,    кв.24, вид.1;ДП «Надвірнянський держлісгосп»;Рішення обвиконкому від 07.07.72 р. № 264
;«Скалки»;пам`ятка природи;комплексна;2,6;Надвірнянський район, Довжинецьке лісництво,  кв.1, вид.20,23;ДП «Надвірнянський держлісгосп»;Рішення обвиконкому від 07.07.72 р. № 264
;«Під скелями»;пам`ятка природи;комплексна;0,5;Надвірнянський район, Зеленське лісництво, кв.30, вид.2;ДП «Надвірнянський держлісгосп»;Рішення обвиконкому від 07.07.72 р. № 264
;«Добротівські відслонення»;пам`ятка природи;комплексна;5;Надвірнянський район, с. Заріччя;Зарічанська сільська рада;Рішення обвиконкому від 07.07.72 р. № 264
;«Великі Голди»;пам`ятка природи;комплексна;24,3;Рогатинський район, с. Лучинці;Лучинецька сільська рада;Розпорядження облдержадміністрації від 23.06.97 р. № 443
;«Вовчинецькі гори»;пам`ятка природи;комплексна;30;Івано – Франківська міська рада р-н с. Вовчинці;Вовчинецька сільська рада;Розпорядження облдержадміністрації від 23.06.97 р. № 443
;«Капличка»;пам`ятка природи;комплексна;1,8;Болехівська міська рада, Болехівське л-во, кв.42, вид.1  кв.36, вид. 38;ДП «Болехівський держлісгосп»;Рішення обласної ради від 12.03.2004. №350-10/2004
;«Табори»;пам`ятка природи;комплексна;10,9;Болехівська міська рада, Болехівське л-во, кв.42, вид.1  кв.28, вид. 15-17;ДП «Болехівський держлісгосп»;Рішення обласної ради від 12.03.2004. №350-10/2004
;«Лисий потік»;пам`ятка природи;комплексна;14,4;Долинський р-н, Витвицьке л-во, кв.3, вид.1,2,3,5,8,9,10  ;ДП «Болехівський держлісгосп»;Рішення обласної ради від 12.03.2004. №350-10/2004
;«Данчиця»;пам`ятка природи;комплексна;6,1;Городенківський район  Придністрянське лісництво кв. 1, вид. 8,9,10;ДП «Коломийське лісове господарство»;Рішення облвиконкому від 16.10.1984 р. № 247
;Разом пам`яток природи комплексних;11;;97,3;;;
;«Тис ягідний»;пам`ятка природи;ботанічна;0,01;Богородчанський район, Манявське лісництво, кв.24, вид.7;ДП «Солотвинський держлісгосп»;Рішення облвиконкому від 19.07.88 р. № 128
;«Бір «Величків»;пам`ятка природи;ботанічна;2,1;Богородчанський район, Яблунівське лісництво,  кв.7, вид.15;ДП «Солотвинський держлісгосп»;Рішення обласної ради від 15.07.93
;«Солотвинські дуби»;пам`ятка природи;ботанічна;0,29;Богородчанський район, с.м.т.Солотвино;Солотвинська селищна рада;Розпорядження облдержадміністрації від 15.07.96 р. № 451, із змінами у площі згідно рішення обласної ради від 12.03.2004. №350-10/2004
;«Еталон букового насадження»;пам`ятка природи;ботанічна;2,4;Верховинський район, Устеріцьке лісництво, кв.15, вид.18;ДП «Гринявський держлісгосп»;Рішення облвиконкому від 07.07.72 р. № 264
;«Еталон смерекового насадження»;пам`ятка природи;ботанічна;3,9;Верховинський район, Гостовецьке лісництво, кв.19, вид.34;ДП «Гринявський держлісгосп»;Рішення облвиконкому від 07.07.72 р. № 264
;«Еталон смерекового насадження»;пам`ятка природи;ботанічна;2,6;Верховинський район, Яловичорське лісництво, кв.14, вид.16;ДП «Гринявський держлісгосп»;Рішення облвиконкому від 07.07.72 р. № 264
;«Еталон смерекового насадження»;пам`ятка природи;ботанічна;2,1;Верховинський район, Яловичорське лісництво,  кв.14, вид.13;ДП «Гринявський держлісгосп»;Рішення облвиконкому від 07.07.72 р. № 264
;«Модрина»;пам`ятка природи;ботанічна;0,5;Верховинський  район, обринськи лісництво, кв.19, вид.15;ДП «Верховинський держлісгосп»;Розпорядження облдержадміністрації від 15.07.96 р. № 451
;«Редискул»;пам`ятка природи;ботанічна;3,2;Верховинський район, с. Буркут;Буркутська сільська рада;Рішення облвиконкому від 07.07.72 р. № 264
;«Еталон смерекового насадження»;пам`ятка природи;ботанічна;3,2;Верховинський район,  Перкалабське обринськ, кв 7, вид.16;ДП «Гринявський держлісгосп»;Рішення обласної ради від 12.03.2004. №350-10/2004
;«Чертяк»;пам`ятка природи;ботанічна;5;м. Городенка;Городенківська міська рада;Рішення облвиконкому від 07.07.72 р. № 264
;«Резерват дуба»;пам`ятка природи;ботанічна;5,7;Болехівська міська рада, обринський лісництво,  кв.36, вид.30;ДП «Болехівський держлісгосп»;Рішення облвиконкому від 07.07.72 р. № 264
;«Алея модрини»;пам`ятка природи;ботанічна;5,4;Болехівська міська рада, обринський лісництво,  кв. 50, вид.20;ДП «Болехівський держлісгосп»;Рішення облвиконкому від 19.07.88 р. № 128
;«Дуб скельний»;пам`ятка природи;ботанічна;1,9;Болехівська міська рада, обринський лісництво,  кв. 52., вид 29-31;ДП «Болехівський держлісгосп»;Рішення обвиконкому від 13.12.76 р. № 478
;«Тис ягідний»;пам`ятка природи;ботанічна;0,03;Болехівська міська рада,  Козаківське лісництво,  кв. 11, вид.13;ДП «Болехівський держлісгосп»;Рішення обвиконкому від 07.07.72 р. № 264
;«Щавна»;пам`ятка природи;ботанічна;13,7;Болехівська міська рада, Козаківське лісництво,  кв. 30, вид.7,13,17;ДП «Болехівський держлісгосп»;Рішення обласної ради від 28.12.99 р. № 237 – 11/99
;«Набивки»;пам`ятка природи;ботанічна;22,8;Болехівська міська рада, Сукільське лісництво, кв. 9, вид. 15-17, кв. 14, вид. 24-26, 32-34;ДП «Болехівський держлісгосп»;Рішення обласної ради від 28.12.99 р. № 237 – 11/99
;«Олірки»;пам`ятка природи;ботанічна;7,4;Болехівська міська рада, Поляницьке лісництво,  кв.32, вид. 5,7,10;ДП «Болехівський держлісгосп»;Рішення обласної ради від 28.12.99 р. № 237 – 11/99
;«Еталон буково – модринового насадження»;пам`ятка природи;ботанічна;1,5;Долинський  район, Витвицьке лісництво, кв. 2, вид.11;ДП «Болехівський держлісгосп»;Рішення обвиконкому від 07.07.72 р. № 264
;«Еталон модринового насадження»;пам`ятка природи;ботанічна;2,8;Долинський район, Витвицьке лісництво, кв. 2, вид.12,15;ДП «Болехівський держлісгосп»;Рішення обвиконкому від 07.07.72 р. № 264
;«Сосна Веймутова»;пам`ятка природи;ботанічна;0,3;Долинський район, Витвицьке лісництво, кв. 3, вид.6;ДП «Болехівський держлісгосп»;Рішення обвиконкому від 13.12.76 р. № 478
;«Дугласії»;пам`ятка природи;ботанічна;1;Долинський район, Витвицьке лісництво, кв. 5, вид.9;ДП «Болехівський держлісгосп»;Рішення обвиконкому від 13.12.76 р. № 478
;«Еталон ялицевого насадження»;пам`ятка природи;ботанічна;5,4;Долинський район, Витвицьке лісництво, кв. 5, вид.14;ДП «Болехівський держлісгосп»;Рішення обвиконкому від 13.12.76 р. № 478
;«Довжанка»;пам`ятка природи;ботанічна;1,8;Долинський район, Витвицьке лісництво, кв. 5, вид.10,18;ДП «Болехівський держлісгосп»;Рішення обвиконкому від 16.09.80 р. № 335
;«Сосна кримська»;пам`ятка природи;ботанічна;0,01;Долинський район, Солотвинське лісництво, кв.1, вид.1;ДП «Вигодський держлісгосп»;Рішення обвиконкому від 07.07.72 р. № 264
;«Правич – 1»;пам`ятка природи;ботанічна;57,1;Долинський район, Правицьке лісництво, кв.16, вид.2,3;ДП «Вигодський держлісгосп»;Розпорядження облдержадміністрації від 15.07.96 р. № 451
;«Правич –2»;пам`ятка природи;ботанічна;5,6;обринськи район, Правицьке лісництво, кв.18, вид.16,19;ДП «Вигодський держлісгосп»;Розпорядження облдержадміністрації від 15.07.96 р. № 451
;«Кропивник»;пам`ятка природи;ботанічна;2,8;Долинський район, Мізунське лісництво, кв.7, вид.4,7;ДП «Вигодський держлісгосп»;Розпорядження облдержадміністрації від 15.07.96 р. № 451
;«Сосна кедрова»;пам`ятка природи;ботанічна;0,01;Долинський район, с. Шевченкове;Шевченківська сільська рада;Рішення обвиконкому від 07.07.72 р. № 264
;«Висока гора»;пам`ятка природи;ботанічна;2;Долинський район, с. Оболонь;Оболонська сільська рада;Рішення обласної ради від 15.07.93
;«Довгий міст»;пам`ятка природи;ботанічна;41,2;Долинський район, с. Оболонь та Раків;Оболонська та Надіївська сільські ради;Рішення обласної ради від 15.07.93
;«Гошівський болотний масив, урочище Гачки»;пам`ятка природи;ботанічна;11,3;Долинський район, с. Тяпче;Тяпчанська сільська рада;Рішення обласної ради від 15.07.93
;«Горіх сірий»;пам`ятка природи;ботанічна;0,01;м. Коломия  обр. Староміська;Коломийська міська рада;Рішення обвиконкому від 07.07.72 р. № 264
;«Магнолія»;пам`ятка природи;ботанічна;0,01;м. Коломия, обр. Театральна;Коломийська міська рада;Рішення обвиконкому від 07.07.72 р. № 264
;«Дуб звичайний»;пам`ятка природи;ботанічна;0,01;Надвірнянський район,  с. Молодьків;Молодьківська сільська рада;Рішення обласної ради від 15.07.93
;«Потоки»;пам`ятка природи;ботанічна;0,5;Надвірнянський район, Надвірнянське лісництво,   кв.6, вид.5;ДП «Надвірнянський держлісгосп»;Рішення обвиконкому від 07.07.72 р. № 264
;«Буковинка»;пам`ятка природи;ботанічна;2;Надвірнянський район, Надвірнянське лісництво,  кв.14, вид.32, 34;ДП «Надвірнянський держлісгосп»;Рішення обвиконкому від 07.07.72 р. № 264
;«Довбушансь-кий праліс»;пам`ятка природи;ботанічна;4,7;Надвірнянський район, Довбушанське лісництво, кв.15, вид.9, 18;ДП «Надвірнянський держлісгосп»;Рішення обвиконкому від 07.07.72 р. № 264
;«Еталон смерекового з домішкою бука насадження»;пам`ятка природи;ботанічна;11;Надвірнянський район, Довбушанське лісництво, кв.22, вид.8;ДП «Надвірнянський держлісгосп»;Рішення обласної ради від 15.07.93 р.
;«Еталон буково – смерекового насадження»;пам`ятка природи;ботанічна;6,5;Надвірнянський район, Довбушанське лісництво,  кв.23, вид.8;ДП «Надвірнянський держлісгосп»;Рішення обласної ради від 15.07.93 р.
;«Еталон ялицево – смерекового насадження»;пам`ятка природи;ботанічна;8;Надвірнянський районн, Довбушанське лісництво,  кв.36, вид.5;ДП «Надвірнянський держлісгосп»;Рішення обласної ради від 15.07.93 р.
;«Еталон ялицево – смерекового насадження»;пам`ятка природи;ботанічна;8,7;Надвірнянський район, Довбушанське лісництво,  кв.36, вид.6;ДП «Надвірнянський держлісгосп»;Рішення обласної ради від 15.07.93 р.
;«Прелуки»;пам`ятка природи;ботанічна;5;Надвірнянський р-н, Зеленське л-во, кв.4, вид 20;ДП «Надвірнянський держлісгосп»;Рішення обвиконкому від 07.07.72 р. № 264
;«Черник»;пам`ятка природи;ботанічна;3,2;Надвірнянський р-н, Зеленське л-во кв.20, вид 31-34;ДП «Надвірнянський держлісгосп»;Рішення обвиконкому від 16.09.80 р. № 335
;«Еталон змішаного ялицево-буково-смерекового насадження»;пам`ятка природи;ботанічна;5,4;Надвірнянський р-н, Бистрицьке л-во, кв.13, вид.5;ДП «Надвірнянський держлісгосп»;Рішення обласної ради від 15.07.93
