17;Урочище “Анциполівське”;заказник;ботанічний;39,1;Немирівський районс. Анциполівка;Зяньковецька сільська рада;Рішення  № 59327 сесії 3 скликання обласної ради від 19.02.2002 р.
18;“Гранітні скелі”;заказник;ботанічний;17,2;Немирівський районс.Грабівці;Грабовецька сільська рада;Рішення  № 59327 сесії 3 скликання обласної ради від 19.02.2002 р.
19;“Ладижинський”;заказник;ботанічний;500;Немирівський  район,верхів‘я  Ладижинського  водосховища з прибережною  смугою;Семенська сільська рада;Рішення облвиконкому №263 від 25.10.90 
20;“Сажчанська дубина”;заказник;ботанічний;102,2;Немирівський  район с. Кіровка   ;Вінницьке обласне комунальне спеціалізоване лісогосподарське підприємство “Віноблагроліс”  ;рішенням  № 525  11 сесії 4 скликання  Вінницької обласної Ради  від 19 березня 2004 року
21;“Кукулянська дача”;заказник;ботанічний;143,65;Піщанський районПіщанська селищна радаПіщанське лісництво кв. 17,18;Крижопільський ДЛГ;Рішення облвиконкому № 371 від 29.08.84 р., № 91 від 03.04.90 р.
22;“Кисерняк”;заказник;ботанічний;37;Піщанський районМиролюбівська сільська радаРудницьке лісництво кв. 35;Крижопільський ДЛГ;Рішення облвиконкому №309 від 20.12.90 
23;Урочище “Кікеї ”;заказник;ботанічний;4,8;Піщанський районБолганська сільська рада( в 5 км від центра села);Болганська сільська рада;Розпорядження Вінницької облдержадміністрації № 200 від 22.12.95 р.
24;“Крутосхили”;заказник;ботанічний;25,5;Тиврівський районДовгополівська сільська рада;Довгополівська  сільська рада;Рішення 11 сесії 23 скликання облради  від 17.12.99 р.
25;“Закрута”;заказник;ботанічний;44;Тиврівський  районс. Рогізне;Маловулизька сільська рада;Рішення облради 9 сесії 22скликання від 28.03.97 р.
26;“Лужки”;заказник;ботанічний;40,5;Томашпільський районс. Вила;Вилянська сільська рада;Рішення 11 сесії 23 скликання від 17.12.99 р.
27;“Стінка”;заказник;ботанічний;40;Томашпільський район с. Стіна ;Стінянська сільська рада;Рішення 11 сесії 23 скликання від 17.12.99 р.
28;“Ободівська дача”;заказник;ботанічний;17;Тростянецький район Ободівська сільська радаОбодівське лісництво, кв.24, діл.1;Бершадський ДЛГ;Рішення виконкому №371 від 29.08.84
29;“Цибулівська дача”;заказник;ботанічний;111;Тростянецький районЦибулівська сільська рада;Ободівське лісомисливське господарство;Рішення облвиконкому №263 від 25.10.90 
30;Урочище “Половича”;заказник;ботанічний;14;Тростянецький районсмт. Тростянець;Тростянецька селищна рада;Рішення облради 9 сесії 22 скликання від 28.03.97 
31;“Дранка”;заказник;ботанічний;22,2;Тульчинський район (за селом Дранка);Дранська сільська рада;Рішення облради 13 сесії 22 скликання від 26.12.97 р.
32;Урочище “Дзерівка”;заказник;ботанічний;11,9;Тульчинський район(північна частина с. Клебані, лівий берег р. Сільниці);Клебанська сільська рада;Рішення облради 13 сесії 22 скликання від 26.12.97 р.
33;Урочище “Гора дубина”;заказник;ботанічний;4,2;Тульчинський районс. Суворівське;Суворівська сільська рада;Рішення облради 13 сесії 22 скликання від 26.12.97 р.
34;Урочище “Березів яр”;заказник;ботанічний;107;Тульчинський районс.Клебаньс.Михайлівка;СТОВ “Перше травня”СТОВ “Добробут”;Рішення 11 сесії 23 скликання облради від 17.12.99р.
35;“Вербська дача”;заказник;ботанічний;46;Чечельницький районс. ВербкаЧервоногреблянське лісництвокв. 6, діл. 3;Чечельницький ДЛГ;Рішення облвиконкому № 599 від 17.11.81 р.
36;“Червоногреблянський”;заказник;ботанічний;1492;"Чечельницький районс. Червона ГребляЧервоногреблянське лісництвокв.22-26; 31-39; 46-52;57-61; 65-69,135";Чечельницький  ДЛГ;Рішення облвиконкому № 263  від 25.10.90 р.
37;“Копистирин”;заказник;ботанічний;146,4;Шаргородський районс. Копистирин(заплава річки Мурафа між с. Копистирин та с. Федорівка);Копистиринська сільська рада;Рішення облвиконкому № 263  від 25.10.90 р.
38;«Шумський»;заказник;ботанічний;20;Крижопільський районс.Вербка (долина річки Марківка);Вербська с/р;Рішення 27 сесії Вінницької обласної ради 5 скликання № 903 від 10 грудня 2009 року
39;«Чагарник»;заказник;ботанічний;5;Іллінецький районТягунська с/рс.Володимирівка;Тягунська с/р;Рішення 27 сесії Вінницької обласної ради 5 скликання № 903 від 10 грудня 2009 року
40;"""Лядівський""";заказник;ботанічний;39,9;Могилів –Подільський районс. Яришів;Яришівська сільська рада;Рішення 23 сесії Вінницької обласної ради 5 скликання  № 747 від 27лютого 2009 року
41;"""Нагорянський""";заказник;ботанічний;145,7;Могилів –Подільський районс.Козлів;Козлівська сільська рада;Рішення 23 сесії Вінницької обласної ради 5 скликання  № 747 від 27лютого 2009 року
42;«Капличка»;заказник;ботанічний;20;Козятинський район, с.Махаринці;Махаринецька с/р;Рішення 28 сесії Вінницької обласної ради 5 скликання № 968 від 02березня 2010 року
43;"""Долина ірисів""";заказник;ботанічний;13,7;;;"Рішення 20 сесії Вінницької обласної ради 6 скликання ""Про створення нових об`єктів природно-заповідного фонду місцевого значення"" №645 від 20.12.2013 року"
;Разом заказників ботанічних;43;;5010,55;;;
1;“Заповідні модрини”;заказник;лісовий;13,3;Барський район, Матійківська сільська рада, Барське лісництво, кв.74 діл.5;Жмеринський ДЛГ;Рішення  облвиконкому від 18.08.83р. №384
2;“Вороновицька дача”;заказник;лісовий;12;Вінницький район, Комарівська сільська рада, Вороновицьке лісництво, кв.12 діл.5;Вінницький лісо-виробничий комплекс;Рішення облвиконкому від 18.08.83р. №384
3;“Калинівський”;заказник;лісовий;10;Калинівський район, Сальницька сільська рада, Калинівське лісництво, кв.122 діл. 2;Вінницький лісо-виробничий комплекс;Рішення облвиконкому від 29.08.84р. №371
4;“Сосновий бір”;заказник;лісовий;17;Калинівський районс.СальникКалинівське лісництво, кв.104 діл. 1;Вінницький лісо-виробничий комплекс;Рішення облвиконкому від 29.08.84р. №371
5;“Брацлавська дача”;заказник;лісовий;12;Немирівський район, Гриненська сільська рада, Брацлавське лісництво, кв. 58 діл. 8.;Тульчинський ДЛМГ;Рішення облвиконкому № 384 від 18.03.83 та №371 від 29.08.84р.
6;“Моївська дача”;заказник;лісовий;19;Чернівецький район, Білянська сільська рада, Моївське лісництво, кв.5 діл.1;Могилів-Полільський ДЛГ;Рішення облвиконкому від 29.08.84р. №371
;Разом заказників лісових;6;;83,3;;;
1;“Мовчани”;заказник;ландшафтний;50,7;Жмеринський район, Мовчанівська сільська рада, с.Мовчани(лівий берег р.Мурашка);Жмеринська районна рада УТМР;Рішення сесії обласної ради 9 сесії 22 скликання від 28.03.97р.
2;“Дністер”;заказник;ландшафтний;436,9;Муровано-Куриловецький районс. Жванс. Наддністрянське;Могилів-Подільський ДЛГТОВ Мур-Куриловецький “Райкомунліс”Жванська сільська радаНаддністрянська сільська рада;Рішення  № 59327 сесії 3 скликання обласної ради від 19.02.2002 р.
3;“Лучанське”;заказник;ландшафтний;82;Немирівський район, Стрільчинецька сільська рада, Немирівське лісництво, кв.131, 132 (біля с.Стрільчинці) ;Іллінецький ДЛГ;Рішення облвиконкому від 29.08.84р. №371
4;“Вище школи”;заказник;ландшафтний;10,6;Піщанський район, Болганська сільська рада(Західна частина с.Болган) ;Болганська сільська рада;Розпорядження облдержадміністрації №200 від 22.12.95р.
5;Урочище “Біля вапняків”;заказник;ландшафтний;34,7;Піщанський район, Болганська сільська рада, с.Болган(по лівий берег р.Кам’янка);Болганська сільська рада;Розпорядження облдержадміністрації №200 від 22.12.95р.
6;“Левада”;заказник;ландшафтний;75;Теплицький район, Брідоцька сільська рада, с.Брідок(південна околиця села);Брідоцька сільська рада;Рішення облвиконкому від 25.10.90р. №263
7;“Бутова”;заказник;ландшафтний;67,4;Теплицький район с.Росоша,  с.Веселівка(південно-східна околиця сіл); Росошанська сільська рада Веселівська сільська рада;Розпорядження облдержадміністрації №200 від 22.12.95р.
8;“Прибузький”;заказник;ландшафтний;62,3;Тульчинський район, Печерська сільська рада(вздовж р.Південний Буг в межах Печерської сільської ради);Печерська сільська рада;Рішення облради 13 сесії 22 скликання 26.12.97р.
9;“Марусине”;заказник;ландшафтний;12;Тульчинський район Кинашівська сільська рада(на півд.сх в 2,5 км від с.Мазурівка);ПСП “Україна”;Розпорядження облдержадміністрації №200 від 22.12.95р
10;Урочище “Федьківське”;заказник;ландшафтний;129;Тульчинський район, с.Клебань;СТОВ “1 –е Травня”;Рішення 11 сесії 23 скликання обласної ради від 17.12.99 року
11;“Ковалева”;заказник;ландшафтний;25;Тульчинський район,  с. Суворівка;Суворівська сільська рада;Розпорядження облдержадміністрації №200 від 22.12.95р
12;“Мурафа”;заказник;ландшафтний;220;Чернівецький район, Вил- Ярузька сільська рада, Лозівська сільська рада, Мазурівська сільська рада(між селами Скалопів і Вила Ярузькі, долина р.Мурафа);ТОВ Чернівецький “Райкомунліс”;Рішення облвиконкому№ 263 від 28.10.90р.
13;“Гопчиця”;заказник;ландшафтний;780;Погребищенський район,с.Гопчиця;СТОВ  “Урожай” с.БухниСТОВ “Новофастівське”;Рішення облвиконкому №263 від 25.10.90р.
14;«Берізки»;заказник;ландшафтний;22,4;Тростянецький район,    с. Четвертинівка;Четвертинівська с/р;Рішення 27 сесії Вінницької обласної ради 5 скликання  № 903 від 10 грудня 2009 року
15;«Баглайові левади»;заказник;ландшафтний;23,7;Іллінецький районс.Білки;Білківська с/р;Рішення 27 сесії Вінницької обласної ради 5 скликання № 903 від 10 грудня 2009 року
16;«Гадаї»;заказник;ландшафтний;7,3;Іллінецький районс.Слободище;Слободищенська с/р;Рішення 27 сесії Вінницької обласної ради 5 скликання  № 903 від 10 грудня 2009 року
17;"""Немиринецьке""";заказник;ландшафтний;30;Козятинський район, с.Немиринці;Переможнянська с/р;Рішення 28 сесії Вінницької обласної ради 5 скликання № 968 від 02березня 2010 року
18;"""Перемога""";заказник;ландшафтний;18;Козятинський район, с.Перемога;Переможнянська с/р;Рішення 28 сесії Вінницької обласної ради 5 скликання № 968 від 02березня 2010 року
19;«Зачарована долина»;заказник;ландшафтний;208,2;"Дмитрашківська с/рВОКСЛП""Віноблагроліс""(Кв.19,21,22)(126,9га)";Піщанський район, Дмитрашківська сільська рада, с.Дмитрашківка(по лівий берег р.Кам’янка);Рішення 25 сесії Вінницької обласної ради 5 скликання  № 834 від 29 липня 2009 року
20;«Надросся»;заказник;ландшафтний;202,2;Дзюньківська с/р(4,0га) -ВОКСЛП “Віноблагроліс”(3,4га)Павлівська с/р(9,2га) -ВОКСЛП “Віноблагроліс”(26,9га)Саражинецька с/р(80,3га) -ВОКСЛП “Віноблагроліс”(78,4га) ВОКСЛП “Віноблагроліс”Кв.54(вид.2)Кв.73(вид1-9)Кв.46(вид2-4)Кв.47(вид1,2;"Погребищенський районДзюньківська с/рПавлівська с/рСаражинецька с/рВОКСЛП""Віноблагроліс""";Рішення 25 сесії Вінницької обласної ради 5 скликання  № 834 від 29 липня 2009 року
21;«Бузький поліг»;заказник;ландшафтний;37,2;"Завадівська с/р(4,3га)ВОКСЛП""Віноблагроліс""(по Завадівській с/р- 3,2га)(по Петрашівській с/р- 19,2га)Кв.29(вид.19-20), 30.";"Теплицький районЗавадівська с/рПетрашівська с/рВОКСЛП""Віноблагроліс";Рішення 25 сесії Вінницької обласної ради 5 скликання  № 834 від 29 липня 2009 року
22;«Турчинський ліс»;заказник;ландшафтний;59,7;"Теплицький районТеплицька селищна радаВОКСЛП""Віноблагроліс""(56,2га) Кв.15.";Теплицький районТеплицька селищна рада;Рішення 25 сесії Вінницької обласної ради 5 скликання № 834 від 29 липня 2009 року
23;«Кавачівська дача»;заказник;ландшафтний;20,5;Теплицький районКивачівська с/р;Кивачівська с/р;Рішення 25 сесії Вінницької обласної ради 5 скликання  № 834 від 29 липня 2009 року
24;«Сашанська левада»;заказник;ландшафтний;42,7;Теплицький районСашанська с/р;Сашанська с/р;Рішення 25 сесії Вінницької обласної ради 5 скликання № 834 від 29 липня 2009 року
25;«Сокирянська балка»;заказник;ландшафтний;10,5;Теплицький районСокирянська с/р;Сокирянська с/р;Рішення 25 сесії Вінницької обласної ради 5 скликання № 834 від 29 липня 2009 року
26;«Урочище «Грабарка»;заказник;ландшафтний;2,6;Тростянецький район,    с.Ободівка;Ободівська с/р;Рішення 25 сесії Вінницької обласної ради 5 скликання № 834 від 29 липня 2009 року
27;«Урочище «Кручі»;заказник;ландшафтний;13,6;Тростянецький район,    с.Новоободівка;Новоободівська с/р;Рішення 25 сесії Вінницької обласної ради 5 скликання  № 834 від 29 липня 2009 року
28;«Урочище«Стінка»;заказник;ландшафтний;11,1;Теплиць кий р-нТополівська с/р ;Теплиць кий р-нТополівська с/р ;Рішення обл..ради№113834сесії 5скликання від 25.10.10р.
29;«Урочище«Березина»;заказник;ландшафтний;36;Теплицький р-нРосошанська  с/р ;Теплицький р-нРосошанська  с/р ;Рішення обл..ради№113834сесії 5скликання від 25.10.10р.
30;«Урочище«Кесарка»;заказник;ландшафтний;9,8;Теплиць кий р-нКивачівська  с/р ;Теплиць кий р-нКивачівська  с/р ;Рішення обл..ради№113834сесії 5скликання від 25.10.10р.
31;«Урочище«Пропадюще»;заказник;ландшафтний;26,9;Теплицький р-нМаломочульська с/р ;Теплицький р-нМаломочульська с/р ;Рішення обл..ради№113834сесії 5скликання від 25.10.10р.
32;«Урочище«Савранський ліс»;заказник;ландшафтний;45,3;Теплиць кий р-нМаломочульська с/р ;Теплиць кий р-нМаломочульська с/р ;Рішення обл..ради№113834сесії 5скликання від 25.10.10р.
33;«Урочище«Бурлацький ліс»;заказник;ландшафтний;57,8;Теплиць кий р-нОрлівська с/р ;Теплиць кий р-нОрлівська с/р ;Рішення обл..ради№113834сесії 5скликання від 25.10.10р.
34;«Урочище«Малий Довжок»;заказник;ландшафтний;22,3;Теплиць кий р-нБрідоцька с/р ;Теплиць кий р-нБрідоцька с/р ;Рішення обл..ради№113834сесії 5скликання від 25.10.10р.
35;«Урочище«Великий Довжок»;заказник;ландшафтний;75,9;Теплиць кий р-нСоболівська с/р ;Теплиць кий р-нСоболівська с/р ;Рішення обл..ради№113834сесії 5скликання від 25.10.10р.
36;«Урочище«Дубина»;заказник;ландшафтний;7;Теплиць кий р-нСоболівська с/р ;Теплиць кий р-нСоболівська с/р ;Рішення обл..ради№113834сесії 5скликання від 25.10.10р.
37;«Урочище«Білашків»;заказник;ландшафтний;82,2;Теплиць кий р-нСоболівська с/р ;Теплиць кий р-нСоболівська с/р ;Рішення обл..ради№113834сесії 5скликання від 25.10.10р.
38;«Урочище«Яструб»;заказник;ландшафтний;94,6;Теплиць кий р-нВеликомочульська с/р ;Теплиць кий р-нВеликомочульська с/р ;Рішення обл..ради№113834сесії 5скликання від 25.10.10р.
39;«Урочище«Савранський ліс»;заказник;ландшафтний;49,6;Теплиць кий р-нВеликомочульська  с/р ;Теплиць кий р-нВеликомочульська  с/р ;Рішення обл..ради№113834сесії 5скликання від 25.10.10р.
40;«Стрімкач»;заказник;ландшафтний;10;Могилів-Подільський  р-нс. Кричанівка;Кричанівська с/р;Рішення 34 сесії 5скликання №1138 обласної ради від 25.10.10р
41;«Моївський сад-парк»;заказник;ландшафтний;54,8;Моївська с/р Чернівецький р-н;Моївська с/р;Рішення 34 сесії Вінницької обласної ради 5 скликання № 1138 від 25.10.10р
42;Миска;заказник;ландшафтний;87,7;Тростянецький    р-н              с.Ободівка;Ободівська сільська рада;Рішення 25 сесії Вінницької обласної ради 4 скликання № 1014 від 23.12.05р.
43;Урочище “Луги”;заказник;ландшафтний;11,02;Немирівський р-н, с. Велика Бушинка;Великобушинська сільська рада;Рішення 25 сесії Вінницької обласної ради 4 скликання № 1014 від 23.12.05р.
44;«Межирівські берізки»;заказник;ландшафтний;1,7;Жмеринський район, Рівська с/р;Рівська с/р;Рішення 5 сесії Вінницької обласної ради 6 скликання № 104 від 29.04.11р.
