№ з.п.;Назва території чи об’єкта ПЗФ;Категорія ;Тип;Площа, га;Місце розташування  території чи об`єкту ПЗФ;Назва установи, підпрємства, організації, землекористувача (землевласника), у віданні якого знаходиться територія чи об’єкт ПЗФ;Рішення, згідно з яким створено (змінено) дану територію чи об’єкт ПЗФ
Території та об`єкти ПЗФ загальнодержавного значення;;;;;;;
1;«Кармелюкове Поділля»;Національний природний парк;;20203,4;Чечельницький районБондурівська, Бритавська, Вербська, Демівська, Куренівська, Любомирська, Лузька, Стратіївська, Тартацька, Червоногреблянська сільські ради Чечельницької селищної ради Чечельницького районуТростянецький районс.Торканівка ;Мінприроди;Указ Президента України                      № 1057/2009 від 16 грудня 2009 року
;Всього національних природних парків;1;;20203,4;;;
1;"Урочище ""Устянська дача""";заказник;ботанічний;173;Бершадський районПоташнянська с/р,Бершадське лісництво,кв. 54-55;Бершадський  ДЛГ;Постанова РМ УРСР від 16.12.82р. №617
2;Іллінецький;заказник;ботанічний;432;Іллінецький районІллінецька міська рада ,Васильківська сільська рада (кв.36,37),Іллінецьке лісництво,кв.35-37, кв.47-50;Іллінецький ДЛГ;Постанова РМ УРСР від2.11.84р. №434
3;Дашівський;заказник;ботанічний;116;Іллінецький районБілківська сільська радаДашівське лісництво кв. 75,76;Дашівське лісомисливське господарство;Постанова РМ УРСР від2.11.84р. №434
4;"Урочище ""Сестринівська дача""";заказник;ботанічний;48;Козятинська сільська рада,Козятинське лісництво,кв. 8;Хмільницький ДЛГ;Постанова РМ УРСР від16.12.82р. №617
5;Дяківці;заказник;ботанічний;223;Літинський районДяковецька сільська рада;Хмільницький ДЛГ;Постанова РМ УРСР від2.11.84р. №434
6;Бронницький;заказник;ботанічний;265;Мог. - Подільський район,Суботіївська сільська радас. Бронниця;Мог. - Подільськийрайагроліс;Постанова РМ УРСР від28.10.74р. №500
7;Вендичанська дубина;заказник;ботанічний;373;Мог.- Подільський районВендичанська сільська радаЮрковецьке лісництво,кв.кв. 1-11,біля с. Вендичани;Мог .- Подільський ДЛГ;Постанова РМ УРСР від03.08.78р. № 383
8;Гарячківська дача;заказник;ботанічний;774;Піщанський районСтавківська та Миролюбівська сільські радиРудницьке лісництво кв. кв. 10 -16 ,21-24,28,29,31,33;Крижопільський ДЛГ;Указ Президента від 21.02.02 № 167/2002
9;Гайдамацька балка;заказник;ботанічний;1217;Тростянецький район,Ободівська сільська рада,Цибулівське лісництвокв. . 28-38,43-49,55-58.;Ободівське ДЛМГ;Постанова РМ УРСР від13.02.89 р. №53
10;"Урочище ""Журавлівська дача""";заказник;ботанічний;595;Тульчинський районСуворівська сільська радаЖуравлівське лісництвокв. кв . 24-27, 36 -39поблизу с. Журавлівка;Тульчинське лісомисливське господарство;Постанова РМ УРСР від16.12.82 р. №617
11;Хмільницька дача;заказник;ботанічний;50;Хмільницький районШироко - Гребельська сільська радаХмільницьке лісництво,кв.29;Хмільницький ДЛГ;Постанова Ради Міністрів УРСР від03.08.78 р.. № 383
12;Бритавський;заказник;ботанічний;3259;Чечельницький районБритавська сільська рада Бритавське лісництво,кв.кв. 24-26,39-42,53-72,76-110;Чечельницький ДЛГ;Постанова Ради Міністрів УРСР від 02.06.90 р.№ 123
13;"Урочище ""Білянський ліс""";заказник;ботанічний;218;Ямпільський районГальжбіївська сільська радаПетрашівське лісництво, кв. 30,31,32;Ямпільський ДЛГ;Постанова Ради Міністрів УРСР від16.12.82 р.№ 617
14;"Урочище ""Криве""";заказник;ботанічний;226;Ямпільський районСеверинівська сільська радаСеверинівське лісництво,кв.27-30;Ямпільський ДЛГ;Постанова РМ УРСР від02.11.84 р. № 434
;Разом заказників ботанічних;14;;7969;;;
1;Коростовецький;заказник;ландшафтний ;370;Гайсинський район;Гайсинський ДЛГ;Указ Президента України від 21.02.02. № 167/2002
2;Володимирська дубина;заказник;ландшафтний ;133;Жмеринський район,Браїлівська сільська рада,Гніванське лісництво кв.32-35;Вінницький лісо-виробничий комплекс;Постанова Ради Міністрів УРСР від28.10.74 р. № 500
3;Грабарківський;заказник;ландшафтний ;487;Могилів - Подільський район,Юрковецька сільська рада,Юрковецьке лісництво ,кв.6-15;ДП “Могилів -Подільський ДЛГ”;Постанова Ради Міністрів УРСР від28.10.74 р. № 500
4;"Урочище ""Самчинецьке""";заказник;ландшафтний ;218;Немирівський район,Новообіходська  сільська рада,Брацлавське лісництво,кв.1-4;ДП “Тульчинське ДЛМГ”;Постанова Ради Міністрів УРСР від16.12.82 р. № 617
;Разом заказників ландшафтних;4;;1208;;;
1;Марксова дубина;заказник;лісовий;295;Немирівський район,Марківська сільська рада,Брацлавське лісництво,кв. 35-40;ДП “Тульчинське ДЛМГ”;Постанова РМ УРСР від28.10.74 р. № 500
;Разом заказників лісових;1;;295;;;
1;Буго - Деснянський;заказник;загальнозоологічний;1073;Вінницький район,Михайлівське лісництво- кв. 15-34Стрижавська с/р - кв. 15,17-21,25,26 =424,0 гаСосонська с/р -кв. 16,22-24 =198,0 гаСтадницька с/р - кв. 27-34=431,0га;Вінницьке ДЛМГ;Постанова РМ УРСР від28.10.74 р. № 500
2;Згарський;заказник;загальнозоологічний;3018,7;Жмеринський район:с. Лисогірка,с .Почапинці,Літинський район:с. Багринівці,с. Бірків,с. Горбівці,с. Микулинці;Лисогірська сільська рада -59,5 га,Почапинецька сільська рада -716,1 га,Багриновецька сільська рада -499,8 га,Бірківська сільська рада -618,3 га,Горбовецька сільська рада -366,1 га,Микулинецька сільська рада -154,3 га,Літинський виробничий рибцех-444,8 гаЛітинський торфозавод -150,0 гаАдміністрація автомобільних доріг у Вінницькій області -9,8 га;Указ Президента України від 21.02.02 № 167/ 2002
;Разом заказників загальнозоологічних;2;;4091,7;;;
;Всього заказників загальнодержавного значення;21;;13563,7;;;
1;"Урочище ""Княгиня""";пам`ятка природи;комплексна;53;Піщанський район,Піщанська с/р,Піщанське лісництво квартали - 1,2;Крижопільський ДЛГ;Розпорядження Ради Міністрів УРСР від 14.10.75 р. № 780-Р
2;"Урочище ""Стінка""";пам`ятка природи;комплексна;90;Ямпільський районПетрашівська с/рПетрашівське лісництво , кв.20;Ямпільський ДЛГ;Розпорядження Ради Міністрів УРСР від 14.10.75 р. № 780-Р
;Разом пам`яток природи комплексних;2;;143;;;
1;"""Терещуків яр""";пам`ятка природи;ботанічна;3,8;Чечельницький районЧечельницька селищна рада, смт. Чечельник, правий берег р. Савранки;Чечельницька селищна рада;Постанова Ради Міністрів УРСР від 28.12.89 р. № 324
2;"""Ромашково""";пам`ятка природи;ботанічна;8,7;Чечельницький районЧечельницька селищна рада;Чечельницька селищна рада;Постанова Ради Міністрів УРСР від 28.12.89 р. № 324
;Разом пам`яток природи ботанічних;2;;12,5;;;
1;"Урочище ""Дубина""";пам`ятка природи;загально-зоологічна;29;Літинський район,Громадська с/р,Соснівська с/рЛітинське лісництво, кв.23,д. 1;Хмільницький ДЛГ;Розпорядження Ради Міністрів УРСР від 14.10.75 р.№ 780 - р. 
2;"Урочище ""Рибчинецька дубина""";пам`ятка природи;загально-зоологічна;40;Хмільницький район,с. Рибчинці с. Маркуші;“Віноблагроліс”,Рибчинецька сільська рада;Розпорядження Ради Міністрів УРСР від 14.10.75 р. № 780 -р.
;Разом пам`яток природи загально-зоологічних;2;;69;;;
1;Відслонення Грушанської світи;пам`ятка природи;геологічна;0,5;Могилів -                       Подільський район,с . Грушка, правий берег р. Мурафи, на північний схід від села;Грушанська сільська рада;Постанова Ради Міністрів УРСР від 21.03.84 р. № 139 
2;Відслонення Могилівської світи;пам`ятка природи;геологічна;0,5;Могилів - Подільський район,с.Немія, північно- західна околиця м. Могилева -Подільського;Немійська сільська рада;Постанова Ради Міністрів УРСР від 21.03.84 р. № 139
3; „Березовий гай”;пам`ятка природи;геологічна;0,5;Могилів -Подільський район,північно - східна околиця с. Бернашівки;Бернашівська сільська рада ;Постанова Ради Міністрів УРСР від 21.03.84 р. № 139
4;"Урочище ""Гайдамацький яр""";пам`ятка природи;геологічна;96;Чернівецький район,с.Бабчинці , вздовжр. БушанкиЯмпільський районс.Буша;"ТОВ  Чернівецьке районне спеціалізоване лісогосподарське підприємство ""Райкомунліс"",Бушанська сільська рада";Розпорядження Ради Міністрів УРСР від 14.10.75 р. № 780
;Разом пам`яток природи геологічних;4;;97,5;;;
;Всього пам`яток природи загальнодержавного значення;10;;322;;;
1;Чернятинський парк;парк-пам’ятка садово-паркового мистецтва;;31;Жмеринський район,Чернятинська сільська рада;Чернятинський аграрний технікум;Постанова Ради Міністрів УРСР від29.01.60 р. № 105
2;Немерчанський  парк;парк-пам’ятка садово-паркового мистецтва;;20;Муровано -Куриловецький район,с. Немерче;"Дослідне господарство ""Україна""";Постанова Ради Міністрів УРСР від29.01.60 р. № 105
3;Немирівський парк;парк-пам’ятка садово-паркового мистецтва;;85;Немирівський район,м. Немирів,вул. Шевченка ,1;"Санаторій ""Авангард"" ";Постанова Ради Міністрів УРСР від29.01.60 р. № 105
4;Антопільський парк;парк-пам’ятка садово-паркового мистецтва;;27;Томашпільський район.Марківська сільська рада,с. Антопіль;Антопільський будинок - інтернат для психічнохворих;Постанова Ради Міністрів УРСР від29.01.60 р. № 105
5;Верхівський парк;парк-пам’ятка садово-паркового мистецтва;;25;Тростянецький район, Верхівська сільська рада;Верхівський сільсько-господарський технікум;Постанова Ради Міністрів УРСР від 29.01.60 р. № 105
6;Ободівський парк;парк-пам’ятка садово-паркового мистецтва;;17;Тростянецький район,Ободівська сільська рада;Ободівська школа - інтернат;Постанова Ради Міністрів УРСР від 29.01.60 р. № 105
7;Печерський парк;парк-пам’ятка садово-паркового мистецтва;;19;Тульчинський районс. Печера;Печерська обласна лікарня відновлювального лікування;Постанова колегії Держком-природи по охороні природи від 17.12.84 р. № 49
8;Парк ім. 50-річчя Жовтня;парк-пам’ятка садово-паркового мистецтва;;20;Хмільницький район,Хмільницька міська рада,вул. Шевченка,20;Лікарня південно- західної залізниці;Постанова колегії Держком-природи по охороні природи від 27.07.87 р. № 25
9;Парк ім. Леніна;парк-пам’ятка садово-паркового мистецтва;;55;Хмільницький район,Хмільницька міська  рада,вул. Першого Травня, 63;"Центральний військовий клінічний санаторій ""Хмільник""";Постанова колегії Держком-природи по охороні природи від 10.06.82 р. № 14
10;"Ботанічний сад ""Поділля""";парк-пам’ятка садово-паркового мистецтва;;72;м. Вінниця, вул. Пирогова,155;"Вінницький Державний аграрний університет, ботанічний сад ""Поділля""";Постанова колегії Держком-природи від 27.07.77 р. № 25
11;Центральний парк культури і відпочинку  ім. Горького;парк-пам’ятка садово-паркового мистецтва;;30;м.Вінниця,вул. Хлібна,1;Центральний парк культури і відпочинку  ім. Горького;Постанова колегії Держком-природи від 27.07.77 р. № 25
;Всього парків-пам`яток садово-паркового мистецтва загальнодержавного значення ;11;;401;;;
;Всього територій та об`єктів ПЗФ загальнодержавного значення;43;;34490,1;;;
Території та об`єкти ПЗФ місцевого значення;;;;;;;
1;«Середнє Побужжя»;регіональний ландшафтний парк;;2618,2;Тиврівський район:Сутиська селищна рада, Тиврівська селищна рада, Довгополівська с/р, Дзвониська с/р, Шендерівська с/р, Колюхівська с/р, Маловулизька с/р;Сутиська селищна рада, Тиврівська селищна рада, Довгополівська с/р, Дзвониська с/р, Шендерівська с/р, Колюхівська с/р, Маловулизька с/р;Рішення 27 сесії Вінницької обласної ради 5 скликання  № 903 від 10 грудня 2009 року
2;«Дністер»;регіональний ландшафтний парк;;6719,48;"м..Могилів-Подільський, . – 1629,03гаМогилів-Подільський район;Бронницька, Ярузька, Суботівська с/р – 3420,0га.Ямпільський район – Бушанська, Гальжбіївська, Михайлівська с/р – 1670,45га.";м..Могилів-Подільський,Бронницька, Ярузька, Суботівська с/рБушанська, Гальжбіївська, Михайлівська с/р;Рішення 27 сесії Вінницької обласної ради 5 скликання  № 903 від 10 грудня 2009 рокуРішення 5сесії Вінницької обласної ради 6 скликання  № 104 від 29 квітня 2011року
3;«Мурафа»;регіональний ландшафтний парк;;3452,7;Чернівецька селищна рада – 78,8 ГАБабчинецька с/р-72,7 га, Вило-Ярузька с/р-1152,2 га, Гонтівська с/р- 53,0 га, Лозівська с/р-476,9 га, Мазурівська с/р- 537,2 га;смт. Чернівціс.Гамулівка с. Коси,      с. Лозовас. Вила Ярузькіс.Скалопільс.Скорячий Яр, с. Гонтівкас. Мазурівка;Рішення 17 сесії Вінницької обласної ради 5 скликання № 573 від 29.05.08р
4;"""Немирівське побужжя""";регіональний ландшафтний парк;;5678;;;"Рішення 16 сесії Вінницької обласної ради 6 скликання ""Про створення нових об`єктів природно-заповідного фонду місцевого значення"" №548 від 20.06.2013 року"
;Всього регіональних ландшафтних парків;4;;18468,38;;;
1;Урочище “Шиянецьке”;заказник;ботанічний;11;Барський районс.ГайовеГаєвська сільська рада;ТОВ “Лан”, с. Гайове;Рішення 11 сесії 23 скликання облради від 17.12.99 р.
2;“Крушинівський”;заказник;ботанічний;594;Бершадський районМаньківська сільська радаСумівське лісництво кв. 40-57;Бершадський ДЛГ;Рішення облради  № 263 від 25.10.90 р.
3;“Сумівський”;заказник;ботанічний;10;Бершадський районСумівська сільська радаСумівське лісництвокв.12, діл. 9;Бершадський ДЛГ;Розпорядження № 421 від 25.10.77 р.
4;“П’ятничанський”;заказник;ботанічний;8,6;Вінницький районСтрижавська сільська радаЯкушинецьке лісництво кв.41, діл. 3-6;Вінницьке ДЛМГ;Рішення облради № 371 від 29.08.84 р.
5;“Стрижавські орхідеї”;заказник;ботанічний;4,3;Вінницький районСтрижавська сільська рада;Стрижавська сільська рада;Рішення облради № 525 від 19.12.85 р.
6;“Запопова”;заказник;ботанічний;35,2;Іллінецький районс.КантелинаКантелинська сільська рада;СТОВ “Дружба”;Рішення 11 сесії 23 скликання облради від 17.12.99 р.
7;“Курочка”;заказник;ботанічний;50,4;Козятинський районс. ЗбаражЗбаразька сільська рада;СФГ “Прогрес”;Рішення 9 сесії  облради від 28.03.97 р.
8;Урочище “Турська стінка”;заказник;ботанічний;40,8;Крижопільський районс.Вільшанка;СТОВ “Вільшанське”;Розпорядження облдержадміністрації № 200 від 22.12.95 р.
9;Урочище “Суха долина”;заказник;ботанічний;18,1;Крижопільський районс.Джугастра;ТОВ “Агрофірма “Крижопіль”;Розпорядження облдержадміністрації № 200 від 22.12.95 р.
10;“Григорівська гора”;заказник;ботанічний;53,7;Могилів –Подільський районс. Бронниця;Бронницька сільська рада;Рішення 11 сесії 23 скликання обласної ради від 17.12.1999р.
11;“Бронницька гора”;заказник;ботанічний;21,2;Могилів –Подільський районс. Бронниця;Бронницька сільська рада;Рішення 11 сесії 23 скликання обласної ради від 17.12.1999р.
12;“Криштофорівська гора ”;заказник;ботанічний;15,3;Могилів –Подільський районс. Бронниця;Бронницька сільська рада;Рішення 11 сесії 23 скликання обласної ради від 17.12.1999р.
13;“Звеняча долина”;заказник;ботанічний;89;Могилів –Подільський районс. Слобода Яришівська;Слобода - Яришівська сільська рада;Рішення 11 сесії 23 скликання обласної ради від 17.12.1999р.
14;“Бернашівський”;заказник;ботанічний;77;Могилів –Подільський районс. Бернашівка;Бернашівська сільська рада;Рішення 11 сесії 23 скликання обласної ради від 17.12.1999р.
15;“Значок”;заказник;ботанічний;63;Мурованокуриловецький районс.В.Ольчедаїв;Могилів - Подільський ДЛГ;Розпорядження виконкому № 336-р від 04.09.1978 р.
16;“Наддністрянський”;заказник;ботанічний;709;Мурованокуриловецький районс.Наддністрянське;Могилів  - Подільський ДЛГ;Рішення облвиконкому № 263 від 25.10.90 р.
